quote,author,tags,likes
"Now how can anybody look at that and not believe in God? I mean, how can anybody look at this and not believe there is some higher power, some divine force at work in the universe greater than Man, some god that created it, that created all this, that created us?",Katharine Hepburn,"creationist, faith",22
"All was in God's plan, and he had to accept even as he didn't understand.","Barbara Cameron,","amish, faith, god",21
"faith gaped at him""how the hell did you do this?""

He looked at her as if she'd asked the dumbest question in history. ""I'm brilliant.","Dianne Sylvan,","david, faith",19
Life is too short to be anything but happy. So kiss slowly. Love deeply. Forgive quickly. Take chances and never have regrets. Forget the past but remember what it taught you.,"Abhishek Shukla,","age, aim, anger, belief, business, change, confidence, courage, creativity, death, desire, dreams, education, failure, faith, family, fear, forgiveness, goal, god, happiness, hate, heart, history, hope, humorous, imagination, inspirational, leadership, life, loneliness, love, marriage, one-liner, opportunity, optimism, patience, patriotism, peace, philosophy, poems, politics, poverty, relationship, religion, romantic, sad, school, science, success, time, truth, ve-attitude, war, wisdom-wise, witty",19
"Holiness is the strength of the soul. It comes by faith and through obedience to God's laws and ordinances. God then purifies the heart by faith, and the heart becomes purged from that which is profane and unworthy. When holiness is achieved by conforming to God's will, one knows intuitively that which is wrong and that which is right before the Lord. Holiness speaks when there is silence, encouraging that which is good or reproving that which is wrong.",James E. Faust,"faith, grace, holiness",18
"My faith in the expertise of physicists like Richard Feynman, for instance, permits me to endorse—and, if it comes to it, bet heavily on the truth of—a proposition that I don't understand. So far, my faith is not unlike religious faith, but I am not in the slightest bit motivated to go to my death rather than recant the formulas of physics. Watch: E doesn't equal mc2, it doesn't, it doesn't! I was lying, so there!","Daniel C. Dennett,","faith, religion, science",18
You’ll only fall if you doubt your balance.,"Willa Okati,","faith, inspirational, life",16
The measure of your faith is the measure of the pain you can endure.,"Dan Brown,","endurance, faith, pain",16
"All right, God, say that You are really there. You have put me in this fix. You want to test me. Suppose I test You? Suppose I say that You are not there? You've given me a supreme test with my parents and with these boils. I think that I have passed Your test. I am tougher than You. If You will come down here right now, I will spit into Your face, if You have a face. And do You shit? The priest never answered that question. He told us not to doubt. Doubt what? I think that You have been picking on me too much so I am asking You to come down here so I can put You to the test! I waited. Nothing. I waited for God. I waited and waited. I believe I slept.","Charles Bukowski,","faith, god",15
"Their lives were violent, precarious, fragile, but they fought for them anyway, and held to the hope that their brief stay on this earth might count for something. That faith was worth preserving.","Leigh Bardugo,","belief-in-yourself, courage, faith, fighting-battles",15
"Faith means I chose not to know, which is different than ignorance which refuses to know.",Craig D. Lounsbrough,"belief, choice, choose, choosing, faith, god, ignorance, ignorant, jaded, know, knowing, refusal, refuse, stubborn, trust, trusting, unbelief",13
Faith can move mountains. So why are you stumbling on a little rock?,Jonathan Nettles,"faith, qoutes",13
"Dr. Keller begins pacing. ""I don't think we've been hearing Faith just right. Her guard...the words..they sound alike.""

What do you mean?""

Your daughter,"" Dr. Keller says flatly. ""I think she's seeing God.","Jodi Picoult,","faith, god, hope",12
Sometimes God has to destroy in order to save. He has to wound in order to heal.,"Francine Rivers,","christianity, faith, god",12
Put your heart and soul into whatever you do – but you won’t be able to do so until you have complete faith in whatever you are doing.,Dr Prem Jagyasi,"able, achieve, believe, complete, confident, faith, heart-and-soul, learn, succeed, task",12
"If it be well weighed, to say that a man lieth, is as much to say, as that he is brave towards God and a coward towards men.",Michel de Montaigne,"cowardice, faith, god, men, truth, veracity",11
"We can say that true gratitude does not give rise to the debtor's ethic because it gives rise to faith in future grace. With true gratitude there is such a delight in the worth of God's past grace, that we are driven on to experience more and more of it in the future...it is done by transforming gratitude into faith as it turns from contemplating the pleasures of past grace and starts contemplating the promises of the future. ",John Piper,"christ, faith",10
"Ivy shrugs. “Poisoning is the Marauders’ way. No offense, but feel free to take some.","S.G. Blaise,","exploration, faith, fast-paced, guardians, hope, lies, mysterious, plots, secrets, treachery",9
"We pray for the big things and forget to give thanks for the ordinary, small (and yet really not small) gifts.","Dietrich Bonhoeffer,","faith, thankfulness",241
God has been there with us every step of the way.,"Gregory S. Works,","altering, chronic-illness, diseases, faith, heal, healing, life, mental, spiritual",82
"As the fear of God is the beginning of wisdom, so the denial of God is the height of foolishness.","R.C. Sproul,",faith,69
"I believe in God the way I believe in quarks. People whose business it is to know about quantum physics or religion tell me they have good reason to believe that quarks and God exist. And they tell me that if I wanted to devote my life to learning what they've learned, I'd find quarks and God just like they did.","Mary Doria Russell,","agnosticism, atheism, faith, god, religion",49
"Indeed, a quick glance around this broken world makes it painfully obvious that we don't need more arguments on behalf of God; we need more people who live as if they are in covenant with Unconditional Love, which is our best definition of God. (p. 21)","Robin R. Meyers,","apologetics, faith, love, theology, unconditional-love",49
"I am more afraid that this people have so much confidence in their leaders that they will not inquire for themselves of God whether they are led by him. I am fearful they settle down in a state of blind self security. Let every man and woman know, by the whispering of the Spirit of God to themselves, whether their leaders are walking in the path the Lord dictates, or not.",Brigham Young,"faith, knowledge, religion, spirituality",49
"Maybe, if you can't get someone out of your head they were never meant to leave. Perhaps, they were meant to help change you into the person you have been waiting to become.",shannon l. alder,"aquaintances, encounters, faith, faith-in-others, faith-in-yourself, family, friends, hanging-on, hello, hope, love, no-coincidences, relationships, strangers, trust, trusting",43
It is better to dwell on the beautiful things in life than the negative.,"Lailah Gifty Akita,","beautiful, faith, grace, grateful, happiness, hope, influences, inspiration, joy, life, negative-influence, negative-people, negative-thoughts, negativity, opinions-of-others, positive-thinking, positivity, thankfulness, wise-words",41
"Alone: for the first time I understood the terrible significance of that word. Alone without a witness, without anyone to speak to, without refuge. The breath in my body, the blood in my veins, all this hurly-burly in my head existed for nobody.","Simone de Beauvoir,","atheism, faith, loneliness, solitude",35
"Hardships are the Lord's greatest blessings to the believer. Without them we would love the Lord only for what He does for us. Our troubles teach us to love Him for who He is."" Sister Norton in ""The Preacher's Bride",Jody Hedlund,faith,33
"Faith is the cure that heals all troubles. Without faith there is no hope and no love. Faith comes before hope, and before love. (Sheikh Muhammad ibn Zaidi bani Tihama)","Paul Torday,",faith,31
For I think belief in God is not a matter of reason at all; I think it finally is a matter of love.,"William Peter Blatty,","faith, reason",29
"Without being push to the wall, we will have remained in our comfortable zone. But this circumstance challenges us to find the courage to move on.","Lailah Gifty Akita,","adversity, capable, challenges, christian-life, circumstance, comfort, courage, defeat, determined-spirit, difficulties-of-life, dont-give-up, failure, faith, fearless, fighting-spirit, hope, inner-strength, never-give-up, obstacles, overcomer, overcoming-obstacles, perseverance, quitting, self-help, self-motivation, self-worth, strength-and-courage, strong-woman, success, victory, winners-mentality, you-can",22
The doing of something productive regardless of the outcome is an act of faith. The doing of a small something when a large something is too much for us is perhaps especially an act of faith. Faith means going forward by whatever means we can.,"Julia Cameron,","faith, perseverance",21
"Faith is not something that goes against the evidence, it goes beyond it. The evidence is saying to us, 'There is another country. There is something beyond mere reason'.",Alister E. McGrath,"evidence, faith, reason",21
In seven days God had created the Earth. In a single day mankind had turned it upside down.,"Kristina McMorris,","faith, god, inspirational, japanese-fiction, philosophy-religion, war, world-war-ii",21
"To be honest with you, I don't have the words to make you feel better, but I do have the arms to give you a hug, ears to listen to whatever you want to talk about, and I have a heart; a heart that's aching to see you smile again.

lines from Love Vs Destiny...",Atul Purohit,"faith, fiction, life, love, novel",20
All religions are man-made; God has not yet revealed himself beyond doubt to anybody.,"Bangambiki Habyarimana,","afterlife, agnostic, agnostic-atheism, agnostic-prayer, agnostic-quote, agnostic-quotes, agnosticism, agnostics, atheism, atheism-defined, atheism-quotes, atheist, atheist-argument, atheist-arguments, atheist-claims, atheist-club, atheist-philosophers, atheist-quotes, atheistic, atheistic-philosophy, atheistic-religion, atheists, bangambiki, belief, belief-in-god, belief-quotes, belief-system, beliefs-quotes, believer, believing, debate, doubt, doubters, doubtful, doubtful-thoughts, doubtfulness, doubting, doubting-mind, doubts, doubts-quotes, ethics, existence, existentialism, faith, faith-in-god, faith-in-yourself, faith-quotes, faith-reason, faith-vs-reason, faithful, faithfulness, false-god, false-gods, fear-of-god, god, goddess, gods, habyarimana-bangambiki, heaven, heaven-and-hell, heaven-on-earth, heaven-quotes, heavenly, heavenly-father, heavenly-rewards, heavens, life, man-made, materialism, meaning-of-life, morality, naturalism, paradise, paradise-quotes, paradises, religion, religion-and-philoshophy, religion-spirituality, religion-vs-science, religious, religious-faith, respect, revelation-quotes, revelations, secular-ethics, self-respect, spirituality, spirituality-quotes, spirituality-vs-religion, supernaturalism, the-great-pearl-of-wisdom, there-is-no-god, unbelief, unbelieve-quotes, unbeliever, unbelievers",19
Bombs have kill-radiuses; churches should have love-radiuses--anyone within twenty miles of a church should know it.,"Tyler Edwards,","christianity, church, faith, jesus, love",18
"Break my heart for what breaks yours
Everything I am for Your Kingdom's cause
As I walk from earth into eternity",Hillsong United,"eternity, faith, god",17
"Even if things aren't going the way we want right now, we will always get through it.","Stacey T. Hunt,","always, faith, going, hope, right-now, things, things-that-matter, through, want, way, we, will, willpower",17
"And if there is no god?
You act as if there is, and it's the same thing.","Janet Fitch,","belief, faith, god",16
"As long as we remain vigilant at building our internal abundance—an abundance of integrity, an abundance of forgiveness, an abundance of service, an abundance of love—then external lack is bound to be temporary.","Marianne Williamson,","abundance, faith, inner-work, unemployment",16
"This is the story of how Dad lived with his lung cancer. But it is much more. Through his illness and the miracles we experienced, I came to see that Dad's was not just a journey. It was a journey home. Home to God. ","Joseph M. Hanneman,","cancer, catholic, faith, inspiration, miracles",15
"If you hold a candle close to you, its flame rises. And if you hold it away from you, its flame shrinks. The same way you hold a candle close to you, keep all your plans, aspirations, projects, and dreams close to you too. Do not share your plans or goals until you complete them, because as you hold your candle away from you, your goals will shrink in the eyes of others. Envy, jealousy, and resentment will put out your flame before it grows.","Suzy Kassem,","aspirations, dreams, faith, inspirational, life, plans, projects, quotes, suzy-kassem",15
"The problem that we are facing in the church today is that we have so many Christians who have made a decision to believe in Jesus but not a commitment to follow Him. We have people who are planning to, meaning to, trying to, wanting to, going to, we just don't have people who are doing it.","Tyler Edwards,","christianity, church, commitment, faith",14
Why do some persons 'find' God in a way that others do not? Why does God manifest His Presence to some and let multitudes of others struggle along in the half-light of imperfect Christian experience? Of course the will of God is the same for all. He has no favorites within His household. All He has ever done for any of His children He will do for all of His children. The difference lies not with God but with us.,"A.W. Tozer,","belief, christian, christianity, faith, god, god-s-presence",14
"God seemed to have become a brand, a packaging, and people purchase this trusted brand with such faith and devotion that they no longer care who the vendor is.","Justin Villanueva,","atheism, atheist, blind-faith, catholic, christian, dogma, faith, freethinker, god, humor, religion",12
He will never let her go. Never. she belongs to him..Forever.,"Awwthentic,","awwthentic, belief, bookworm, couple, diary, dreams, ebook-ereading, fairy, faith, friends, heart, love, loveletter, lovers, note, prince, romance, rose, wattpad, wattpadaddicts, wattpadlife, wattpadshouts, wattpadstories, wishes",10
"There was no way to abandon guilt, no decent way to disown it. All the tangles and knots of bitterness and desperation and fear had to be pitied. No, better, grace had to fall over them.","Marilynne Robinson,","faith, grace, guilt",10
"Love taught me to die with dignity that I might come forth anew in splendor. Born once of flesh, then again of fire, I was reborn a third time to the sound of my name humming haikus in heaven’s mouth.","Aberjhani,","death, dignity, faith, haiku, healing, heaven, human-mortality, love, metaphysics, national-poetry-month, philosophy, rebirth, recovery, resurrection, spirituality, starting-over, wisdom",91
"Whatever your passion is, keep doing it. Don't waste time chasing after success or comparing yourself to others. Every flower blooms at a different pace. Excel at doing what your passion is and only focus on perfecting it. Eventually people will see what you are great at doing, and if you are truly great, success will come chasing after you.","Suzy Kassem,","achievement, ambition, attitude, blooms, chase, comparing-to-others, comparison, comparison-to-others, doubt, drive, excel, excellent, faith, fear, flower, focus, great, greatness, insecurity, life, motivation, passion, passionate, skill, success, successful, time, waste-time, willpower",83
Whatever negative things people think and say about you is enough to bring you down provided you belief that it carries a weight that can push you hard. Don't agree to accept what critics say; be prepared to silence them by doing what they think you can't do!,"Israelmore Ayivor,","agree, belief, believe, carry, critic, criticise, critics, detractors, discouragements, enemies, fail, failure, faith, fall, food-for-thought, hard, heavy, insults, israelmore-ayivor, lower, negative, negative-people, prepare, push, push-hard, silence, weight, you-can-do-it",76
"It isn't for the moment you are struck that you need courage, but for that long uphill climb back to sanity and faith and security.",Anne Morrow Lindbergh,"courage, faith, grieving, grieving-mother, sanity, security",68
"It is hard to see how a great man can be an atheist. Without the sustaining influence of faith in a divine power we could have little faith in ourselves. We need to feel that behind us is intelligence and love. Doubters do not achieve; skeptics do not contribute; cynics do not create. Faith is the great motive power, and no man realizes his full possibilities unless he has the deep conviction that life is eternally important, and that his work, well done, is a part of an unending plan.",Calvin Coolidge,"atheism, creativity, faith, god",56
"People will always notice something about you. It might be the way you walk or the way you talk, or just simply your personality. Live each day in the way you want to be remembered. Live in such a way that people will be inspired by those unique qualities that you have and strive to live better lives for themselves.",Amaka Imani Nkosazana,"compassion, faith, happiness, hope, inspiration, kindness, life, living, love, passionate, peace, peace-of-mind, rememberance",53
You are entitled to know that two entities occupy your body. One of these entities is motivated by and responds to the impulse of fear. The other is motivated by and responds to the impulse of faith. Will you be guided by faith or will you allow fear to overtake you?,"Napoleon Hill,","faith, fear",50
Beware the religion that turns you against another one. It's unlikely that it's really religion at all.,"Joan D. Chittister,","faith, religion",45
"Guidance, like all God's acts of blessing under the covenant of grace, is a sovereign act. Not merely does God will to guide us in the sense of showing us his way, that we may tread it; he wills also to guide us in the more fundamental sense of ensuring that, whatever happens, whatever mistakes we may make, we shall come safely home. Slippings and strayings there will be, no doubt, but the everlasting arms are beneath us; we shall be caught, rescued, restored. This is God's promise; this is how good he is.","J.I. Packer,","faith, goodness-of-god, guidance, perseverance, sovereignty-of-god",44
"Some people say they will not believe in anything they can't see. What a catastrophe to not have any faith at all! You live only less than a half of life, if you will only believe in the things that you can see. Life is lived by those who have much faith and believe in many unseen things. If you believe in nothing that you cannot see, think about how much there is that you choose to turn your face away from! You can't see your soul and you cannot prove that it exists, therefore if you call yourself one who believes in nothing unseen, then you will forever deny your soul its existence, for the existence of the soul dwells in love, trust, anger, passion, faith, belief, strength; the soul is forever nourished by things that are unseen! And so we have too many empty bodies walking around! Bodies with souls inside that are half-dead and dying.",C. JoyBell C.,"belief, believing, faith, humanity, inspirational, inspirational-life, inspirational-quotes, soul, spirit, unseen-things",43
"There are 6 reasons that a person does anything: Love, faith, greed, boredom, fear... revenge.","Ally Carter,","boredom, faith, fear, greed, love, revenge",39
"While you are going through your trial, you can recall your past victories and count the blessings that you do have with a sure hope of greater ones to allow if you are faithful.",Ezra Taft Benson,"adversity, blessings, faith, trials",38
Every beginner possesses a great potential to be an expert in his or her chosen field.,"Lailah Gifty Akita,","abilities, advice, beginner, beginner-s-guide, christian-life, college, courses, dont-give-up, dont-quit, education, encouragement, expert, failure, faith, great, greatness, hard-working, hope, inner-strength, interest, job, learn, learning, mentoring, never-give-up, passion, potential, school, self-confidence, self-education, self-esteem, self-love, self-study, skills, student, study, success, training, try-your-best, university, uplifting, wise-words, work, writing-advice, you-can, your-life",37
"We are not asked to SEE,"" said Amy. ""Why need we when we KNOW?"" We know--not the answer to the inevitable Why, but the incontestable fact that it is for the best. ""It is an irreparable loss, but is it faith at all if it is 'hard to trust' when things are entirely bewildering?","Elisabeth Elliot,","christian-living, faith",35
"The question the doubter does not ask is whether faith was really useless or simply not used. What would you think of a boy who gave up learning to ride a bicycle, complaining that he hurt himself because his bicycle stopped moving so he had no choice but to fall off? If he wanted to sit comfortably while remaining stationary, he should not have chosen a bicycle but a chair. Similarly faith must be put to use, or it will become useless.","Os Guinness,",faith,32
"Da used to say that lies were easy, but trust was hard. Trust is like faith: it can turn people into believers, but every time it's lost, trust becomes harder and harder to win back.","Victoria Schwab,","distrust, doubt, faith, lying, trust, trustworthy",30
"Each day gives the opportunity for you to be treated right, to feel worthy, and to be successful. It’s a choice you have to make, a faith you have to embrace, and a standard you have to set.","Steve Maraboli,","carpe-diem, faith, inspirational, life, motivational, success, truth",25
"When Lincoln was asked if God was on the Union’s side, Lincoln’s unvarying response was that what was really important was whether they were on God’s side.","Joe Wheeler,","abraham-lincoln, faith, god, history",24
"Some acts of faith, I believe, have the power to grant us something infinitely wiser than we imagine","Ursula Hegi,",faith,22
"Always have faith in yourself and the universe, for one will not get you anywhere without the other. Both must be equally strong to reach your desires, for they are the wings that will lift you to your dreams.","Suzy Kassem,","belief, bravery, courage-in-life, desires, doubt, dreams, faith, fear, fearlessness, self-doubt, strength, universe, wings, yourself",21
"Faith, Princess,"" the Prism Cat repeated. ""It is a highly underrated weapon against the dark things in this world.","Terry Brooks,",faith,20
"He has no need for faith who knows the uncreated, who has cut off rebirth, who has destroyed any opportunity for good or evil, and cast away all desire. He is indeed the ultimate man.","Gautama Buddha,","attachment, awakening, balance, creation, desire, enlightenment, equanimity, faith, good-and-evil, know-thyself, meaning-of-life, nirvana, religion, spiritual, suffering, wisdom",18
"Fatigue can make it hard to have faith. Too much busyness can make it hard to have faith. Too much of too little solitude can impact faith. For that matter, so can a bout of hunger or overwork, anything carried to an extreme. Faith thrives on routine. Look at any monastery and you will see that. Faith keeps on keeping on.","Julia Cameron,",faith,13
"There are some who are still weak in faith, who ought to be instructed, and who would gladly believe as we do. But their ignorance prevents them...we must bear patiently with these people and not use our liberty; since it brings to peril or harm to body or soul...but if we use our liberty unnecessarily, and deliberately cause offense to our neighbor, we drive away the very one who in time would come to our faith. Thus St. Paul circumcised Timothy (Acts 16:3) because simple minded Jews had taken offense; he thought: what harm can it do, since they are offended because of ignorance? But when, in Antioch, they insisted that he out and must circumcise Titus (Gal. 2:3) Paul withstood them all and to spite them refused to have Titus circumcised... He did the same when St. Peter...it happened in this way: when Peter was with the Gentiles he ate pork and sausages with them, but when the Jews came in, he abstained from this food and did not eat as he did before. Then the Gentiles who had become Christians though: Alas! we, too, must be like the Jews, eat no pork, and live according to the law of Moses. But when Paul learned that they were acting to the injury of evangelical freedom, he reproved Peter publicly and read him an apostolic lecture, saying: ""If you, though a Jew, live like a Gentile, how can you compel the Gentiles to live like Jews?"" (Gal. 2:14). Thus we, too, should order our lives and use our liberty at the proper time, so that Christian liberty may suffer no injury, and no offense be given to our weak brothers and sisters who are still without the knowledge of this liberty.",Martin Luther,"faith, food, liberty, pork, weak",12
"A disciple: I am worried about human suffering all over the world. What is the solution?Spiritual leader: The solution to our miseries lie within central atom of our being, ‘I’. Once this central atom transcends to ‘WE’, human sufferings can be resolved.","Santosh Kalwar,","faith, religious, spirituality, truth",12
