quote,author,tags,likes
"Life's trials will test you, and shape you, but don’t let them change who you are.”
~ Aaron Lauritsen, ‘100 Days Drive","Aaron Lauritsen,","100-days-drive, 100daysdrive, acceptance, accomplish, adventure, ambition, author, awakening, be-happy, be-proud, believe, bestrong, bestseller, bohemian, break-barriers, carma, chances, change, chase-dreams, cherish, coming-of-age, compassion, competition, confidence, conquer, conquer-fear, content, control-your-life, courage, crossroads, destiny, determination, dig-deep, don-t-give-up, don-t-worry-be-happy, dream-big, dreamer, empower, energy, enjoy-life, explore, faith, fearless, find-yourself, follow-your-dreams, follow-your-heart, follow-your-own-path, forgive, free, freedom, fresh-start, goal-setting, goals, goals-in-life, good-soul, gratitude, happiness, heal, high-road, hope, humanity, humility, inner-beauty, inner-strength, inspiration, journey, joy, judgement, laugh, learn, liberate, liberating, life, life-lessons, light, limitless, live-life-quotes, love-thy-neighbor, love-thyself, love-yourself, luck, memoir, never-quit, no-regrets, nomad, one-life, open-road, opportunity, parenthood, perspective, positive-thinking, power, pride, push-limits, quote-of-the-day, quotes, reflections, resiliency, respect, risk-taking, road-trip, satisfaction, service-to-others, smile, soar, soul-food, spirituality, start-all-over, staystrong, strength, struggle, success, teamwork, thick-skin, think-outside-the-box, travel, truth, values, wander, wanderlust, wateroffaducksback, writer",91
There’s something really cool about knowing that your destiny is SO big that you’re not meant to share it with anyone. At least not yet.,"Mandy Hale,","being-single, destiny, dreams, faith, faith-in-yourself, finding-yourself, life, love, positive-thinking, sharing-your-life-with-someone, single, single-life, single-woman, singleness, the-single-woman, trust, walking-alone, your-journey",85
"I will not attack your doctrines nor your creeds if they accord liberty to me. If they hold thought to be dangerous - if they aver that doubt is a crime, then I attack them one and all, because they enslave the minds of men.

I attack the monsters, the phantoms of imagination that have ruled the world. I attack slavery. I ask for room -- room for the human mind.","Robert G. Ingersoll,","doubt, faith, liberty, religion, skepticism, slavery",82
"I can only say that I am nothing but a poor sinner, trusting in Christ alone for salvation.",Robert E. Lee,"faith, religion",79
"It is not as much about who you used to be, as it is about who you choose to be.",Sanhita Baruah,"aims, ambitions, ambitious, attitude, career, choices, choose, decisions, encourage, faith, future, happiness, happy, hope, hopeful, inspirational, life, love, motivational, motive, move-on, past, present, self-development, self-help, self-improvement, success, work-hard, workaholic",75
"I love the recklessness of faith. First you leap, and then you grow wings.","William Sloane Coffin,",faith,74
"When you are down to nothing, God is up to somethng. It is up to you to reach out to find what God is up to for you.",Robert Schuler,"christianity, coaching-executive, faith",73
"No matter how many times you failed or have fallen, no matter how many times you’ve denied God, He will not deny you.","Gregory Dickow,","courage, dig-deep, don-t-judge, explore, faith, find-yourself, goal-setting, judgement, laugh, learn",72
"Science tells me God must exist.
My mind tells me I'll never understand God.
My heart tells me I'm not meant to.

[Vittoria Vetra]","Dan Brown,","faith, religion, science",60
"Does your love reach this far, God? And if it extends to heaven and beyond… why can’t it seem to find me?","Jenny B. Jones,","faith, god-s-love",59
"The same everlasting Father who cares for you today will care for you tomorrow and every day.
Either he will shield you from suffering or give you unfailing strength to bear it.
Be at peace then and put aside all anxious thoughts and imaginings.",Francis de Sales,"faith, god, peace, strength",55
"At such times, the heart of man turns instictively towards his Maker. In prosperity, and whenever there is nothing to injure or make him afraid, he remembers Him not, and is ready to defy Him; but place him in the midst of dangers, cut him off from human aid, let the grave open before him, then it is, in the time of his tribulation, that the scoffer and unbelieving man turns to God for help, feeling there is no other hope, or refuge, or safety, save in his protecting arm.","Solomon Northup,","faith, god, prayer, religion, spirituality, stress, trials-and-tribulations, tribulations, worry",55
"You've a right to believe that we're governed by Nature and the hidden Force within her. You can think that the gods, including my Melitele, are merely a personification of this power invented for simpletons so they can understand it better, accept its existence. According to you, that power is blind. But for me, Geralt, faith allows you to expect what my goddess personifies from nature: order, law, goodness. And hope.","Andrzej Sapkowski,","faith, gods, polytheism, religion",54
"God has prepared for Himself one great song of praise throughout eternity, and those who enter the community of God join in this song. It is the song that the “morning stars sang together and all the sons of God shouted for joy” at the creation of the world. (Job 38:7). It is the victory song of the children of Israel after passing through the Red Sea, the Magnificat of Mary after the annunciation, the song of Paul and Silas in the night of prison, the song of the singers on the sea of glass after their rescue, the “song of Moses the servant of God, and the song of the Lamb” (Rev. 15:3) It is the song of the heavenly fellowship.","Dietrich Bonhoeffer,","faith, inspiration, song",53
We're stronger than we think.,"Joe Kelly,","faith, strength",51
"The Christian should work as if all depended upon him, and pray as if it all depended upon God.",Charles H. Spurgeon,"faith, prayer, work",50
"Ask and it shall be given you,'"" I began. ""'Seek and ye shall find; knock, and it shall be opened unto you; For every one that asketh receiveth; and he that seeketh findeth; and to him that knocketh it shall be opened.' We have the same message in the Book of Saint John,"" I said, sounding for all the world like a preacher....""
Well, but how could I just stop there? Those words were worse than nothing if I didn't tell what they meant to Grandpa. Looking at the long rough box, I spoke timid, in a mumbled voice. Not preachified at all. ""Grandpa didn't think Jesus meant, by that, that we should ast God for things, or for special favors. He said we could trust that in the nature of things, without astin', we'll get lots of blessin's and happy surprises and maybe a miracle or two. When Jesus said ast and you'll get it, He meant things of the spirit, not the flesh. Right now for instance, I could ast, 'Lord please raise Grandpa from the dead,' but it wouldn't happen. But I can say, 'Please, God, comfort me,' and I'll get heart's ease. Grandpa said Jesus meant us to ast for hope, forgiveness, and all that. Ast, 'Hep us not be scared, hep us not be greedy, give us courage to try."" I was really carried away. ""Ast any such and God will give it to you. But don't ast Him not to let fire burn, or say spare me from death. At least, uh, that's what Grandpa said.","Olive Ann Burns,","faith, god, hope",46
It is better to live ready than to get ready!,Smith Wigglesworth,"faith, inspirational",45
"No matter what argument you make against evolution, the response is Well, you know, it's possible to believe in evolution and believe in God. Yes, and it's possible to believe in Spiderman and believe in God, but that doesn't prove Spiderman is true.","Ann Coulter,","faith, humor, politics",44
"That's how you avoid becoming a moth,"" he says. ""Stop asking others what to believe. Figure it out for yourself.","Stephanie Oakes,","belief, faith, humanity",43
"Explore, Experience, Then Push Beyond.","Aaron Lauritsen,","100-days-drive, 100daysdrive, acceptance, accomplish, ambition, author, awakening, be-happy, be-proud, believe, bestseller, break-barriers, carmaker, chances, change, chase-dreams, cherish, compassion, competition, confidence, conquer, conquer-fear, content, control-you-life, courage, crossroads, destiny, determination, dig-deep, don-t-give-up, don-t-worry-be-happy, dream-big, dreamer, empower, energy, explore, faith, fearless, find-yourself, follow-your-dreams, follow-your-heart, follow-your-own-path, forgive, freedom, fresh-start, goal-setting, goals, goals-in-life, good-soul, happiness, hope, humanity, humility, inner-beauty, inner-strength, inspiration, journey, joy, judgement, liberate, liberating, life, life-lessons, light, live-life-quotes, love-thy-neighbor, love-thyself, love-yourself, luck, memoir, never-quit, no-regrets, nomad, one-life, opportunity, parenthood, perspective, positive-thinking, power, pride, push-limits, reflections, resiliency, respect, risk-taking, road-trip, satisfaction, service-to-others, soar, soul-food, spirituality, start-all-over, strength, struggle, success, thick-skin, think-outside-the-box, travel, values, wander, wanderlust, writer",42
"They say faith is taking the first step when you can’t see the whole staircase. Actually, wisdom is seeing the elevator behind it that would have taken you to the top floor.",Shannon L. Alder,"beliefs, choices, decisions, experiences, faith, god-s-plan, helping, intelligent-people, kindred-spirits, learning, life-lessons, like-minded, meeting-people, no-coincidences, paying-attention, people, recognizing, seeing, self-transformation, socrates, staircase, teachers, wisdom",41
"No matter how hopeless I feel, there's always a little more hope inside me. No matter how faithless I think I am, there is always something to believe in.","Lexi Ryan,","faith, hope, lexi-ryan, resilience, these-hollow-vows, trust",41
"It all comes down to a choice. Either choose a life separate from God, which comes with the worry that things can fall apart at any moment, or follow the Lord and enjoy extraordinary confidence in knowing you can achieve greatness and will have the happiest of endings.","Spencer C Demetros,","biblical-message, book-of-god, christian, christianity, faith, find-god, humour, love, teens, young-adult",28
We are not on this planet to ask forgiveness of our deities,"Scott Cunningham,","deity, earth, faith, god, goddess, love, paganism, planet, wicca",152
You need to have faith in yourself. Be brave and take risks. You don't have to have it all figured out to move forward.,Roy T. Bennett,"authentic-living, being-positive, brave, courage, faith, inspiration, inspirational, inspirational-quotes, life, life-quotes, motivation, moving-forward, optimism, optimistic, positive, positive-affirmation, positive-life, positive-thinking, start-up",119
"To have faith is to be sure of the things we hope for, to be certain of the things we cannot see.","Anonymous,","faith, god, hope, pleasing-to-god",93
"Faith is a fine invention
When gentlemen can see,
But microscopes are prudent
In an emergency.",Emily Dickinson,"faith, religion, science",90
What we are waiting for is not as important as what happens to us while we are waiting. Trust the process.,"Mandy Hale,","consecration, faith, positive-thinking, preparation, seasons-of-waiting, the-process, trust, trust-the-process, trusting-your-journey, wait, waiting",90
"Gifts of grace come to all of us. But we must be ready to see and willing to receive these gifts. It will require a kind of sacrifice, the sacrifice of believing that, however painful our losses, life can still be good — good in a different way then before, but nevertheless good. I will never recover from my loss and I will never got over missing the ones I lost. But I still cherish life. . . . I will always want the ones I lost back again. I long for them with all my soul. But I still celebrate the life I have found because they are gone. I have lost, but I have also gained. I lost the world I loved, but I gained a deeper awareness of grace. That grace has enabled me to clarify my purpose in life and rediscover the wonder of the present moment.","Jerry Sittser,","faith, grace, grief, loss, mourning",87
"Faith is a great thing, and really religious people would like us to believe that faith and knowing are the same thing, but I don't believe that myself. Because there are too many different ideas on the subject. What we know is this: When we die, one of two things happens. Either our souls and thoughts somehow survive the experience of dying or they don't. If they do, that opens up every possibility you could think of. If they don't, it's just blotto. The end.","Stephen King,",faith,83
There had to be dark and muddy waters so that the sun could have something to background it's flashing glory.,Betty Smith,"faith, hope",67
"I prayed that our growth would be as strong and determined as the seeds of coconut palms, boldly reaching skyward toward the sun diligently boring deeper into the earth to secure a firm foundation for the beautiful, durable, fruit-bearing trees they would become. For me, Mhonda was the place to continue the growth of the still young but strong roots of my tree planted in Kifungilo. This was my life now, the life I’d prayed for, the life that would provide me with an education and would open doors. I wanted this life very much. I told my wavering spirit to bear with me because, just like the coconut palm, I would sway and bend and bruise, but I would survive. I would have to become the tree in the African saying: ‘The tree that bends with the wind does not break.","Maria Nhambu,","autobiography, bravery, challenging-status-quo, determination, faith, growth, inspirational, positive-thinking",67
What we call rational grounds for our beliefs are often extremely irrational attempts to justify our instincts.,Thomas Henry Huxley,"belief, faith, religion, science, skepticism",62
My faith is big enough to accept all of God's wonders.,"Kirsten Miller,","faith, god, inspirational",62
"I went to the recreation room and knelt down in front of the same Nativity scene where I’d prayed to Baby Jesus to find my mother when I was a child. I looked at him lying there in his bed of hay and wondered why this scene never left me. Over the years, whenever I prayed, I prayed to Baby Jesus. He was the miracle baby who never grew up. I believed that he really listened to me and often answered me. As I knelt there I realized that Sister Silvestris was right all along. She told us every Christmas that whatever we asked of Baby Jesus he’d grant us.","Maria Nhambu,","childhood, faith, love, optimism, positivity, prayers, religion",60
"Back of every creation, supporting it like an arch, is faith. Enthusiasm is nothing: It comes and goes. But if one believes, then miracles occur.",Henry Miller,faith,59
Faith doesn't mean that you never doubt. It only means that you never act upon your doubts.,"Orson Scott Card,","doubt, faith",59
Our kindness may be the most persuasive argument for that which we believe.,Gordon B. Hinckley,"faith, kindness, truth",57
"[The] insistence on the absolutely indiscriminate nature of compassion within the Kingdom is the dominant perspective of almost all of Jesus' teaching.
What is indiscriminate compassion? 'Take a look at a rose. Is is possible for the rose to say, ""I'll offer my fragrance to good people and withhold it from bad people""? Or can you imagine a lamp that withholds its rays from a wicked person who seeks to walk in its light? It could do that only be ceasing to be a lamp. And observe how helplessly and indiscriminately a tree gives its shade to everyone, good and bad, young and old, high and low; to animals and humans and every living creature -- even to the one who seeks to cut it down. This is the first quality of compassion -- its indiscriminate character.' (Anthony DeMello, The Way to Love)...
What makes the Kingdom come is heartfelt compassion: a way of tenderness that knows no frontiers, no labels, no compartmentalizing, and no sectarian divisions.","Brennan Manning,","christianity, compassion, faith, jesus, kingdom, light, servanthood, spiritual-life, tenderness",55
...history has shown that the most terrible crimes against love have been committed in the name of fanatically defended doctrines.,"Paul Tillich,","faith, fanaticism, love",55
"But it will be harder for you if you remember. Love is always harder. Love means weathering blows for another’s sake and not counting them. Love is loss of self, loss of other, and faith in the death of loss.","Christopher Buehlman,","faith, love",54
"What do people fear most about death? I asked the reb.
""Fear?"" he thought for a moment. 'Well, for one thing, what happens next? Where do we go? Is it what we imagined?""
That's big.
""Yes. But there's something else.""
What else?
He leaned forward.
""Being forgotten,"" he whispered.",Mitch Albom,"faith, have, little",53
"God’s revelation does not need the light of human genius, the polish and strength of human culture, the brilliancy of human thought, the force of human brains to adorn or enforce it; but it does demand the simplicity, the docility, humility, and faith of a child’s heart.","E.M. Bounds,","faith, revelation",49
"At some point, you just gotta forgive the past, your happiness hinges on it.","Aaron Lauritsen,","100-days-drive, 100daysdrive, acceptance, accomplish, ambition, author, awakening, be-happy, be-proud, believe, bestseller, break-barriers, carmaker, chances, change, chase-dreams, cherish, compassion, competition, confidence, conquer, conquer-fear, content, control-you-life, courage, crossroads, destiny, determination, dig-deep, don-t-give-up, don-t-worry-be-happy, dream-big, dreamer, empower, energy, explore, faith, fearless, find-yourself, follow-your-dreams, follow-your-heart, follow-your-own-path, forgive, freedom, fresh-start, goal-setting, goals, goals-in-life, good-soul, happiness, hope, humanity, humility, inner-beauty, inner-strength, inspiration, journey, joy, judgement, liberate, liberating, life, life-lessons, light, live-life-quotes, love-thy-neighbor, love-thyself, love-yourself, luck, never-quit, no-regrets, nomad, one-life, opportunity, parenthood, perspective, positive-thinking, power, pride, push-limits, reflections, resiliency, respect, risk-taking, road-trip, satisfaction, service-to-others, soar, soul-food, spirituality, start-all-over, strength, struggle, success, thick-skin, think-outside-the-box, values, wander, wanderlust, writer",49
"I love to walk. Walking is a spiritual journey and a reflection of living. Each of us must determine which path to take and how far to walk; we must find our own way, what is right for one may not be for another. There is no single right way to deal with late stage cancer, to live life or approach death, or to walk an old mission trail.","Edie Littlefield Sundby,","adversity-quotes, advice-for-daily-living, cancer, christian, courage, courage-quotes, death, death-quotes, empowering-quotes, empowerment, faith, faith-in-yourself, faith-quotes, fear, fear-quotes, god, god-s-grace, god-s-love, gods-grace, happy, happy-quotes, health, hope, hope-quotes, illness, illness-and-hope, inspirational, life, life-and-living, life-lessons, life-quotes, love, love-quotes, self-confidence, self-help, self-improvement, self-love, spiritual, spirituality, strength, strength-and-courage, strength-of-mind, strength-of-spirit, strength-of-will, strength-quotes, strength-through-adversity, walk, walker, walking, well-being, wellbeing, wellness, wisdom-quotes",48
"You have to stand guard over the development and maintenance of Islamic democracy, Islamic social justice and the equality of manhood in your own native soil.",Muhammad Ali Jinnah,"ali, corruption, development, discipline, education, equality, faith, guard, harmony, islam, jinnah, justice, leader, life, love, maintenance, manhood, morals, muhammad, native, pakistan, peace, power, social, society, soil, stand, system, thinking, unity, values",47
"But, he duly ate the peanut and whoosh!","Molly Arbuthnott,","animals, children-books, children-s-learning, faith, fiction, fiction-books, friendship, hope, love, pets",41
"Where humanity
sowed faith, hope, and unity,
joy’s garden blossomed.","Aberjhani,","america-remembers, americans, faith, famous-quotes-from-classic-books, haiku, haikus, healing, history, humanity, joy, multiculturalism, multiculturalismo, multiculturalità, national-history-day, patriotism, personal-growth, philosophy, rebith, rejuvenation, remembering-september-11, spirituality, teaching-diversity, world-suicide-prevention-day",40
Small souls who seek power over others first destroy the faith those others might have in themselves.,"Frank Herbert,","faith, power, self",37
God existed before every religion; He exists in spite of all religions.,"Danail Hristov,","faith, god, inspiration, truth, wisdom",34
...and when is enough proof enough?,"Jonathan Safran Foer,","evidence, faith, proof",31
"It’s called walking by faith, not sitting by faith",Daniel Mangena,faith,28
"Skin boils! Boils cause serious pain and physical suffering, and you also have to consider the ugliness factor. Even the most powerful zit cream on earth would be no match for the Lord Almighty’s epidermal masterpieces. So this one wins for my pick of the nastiest of the first nine plagues -- a dubious honor indeed.","Spencer C Demetros,","biblical-message, book-of-god, christian, christianity, faith, find-god, humour, love, teens, young-adult",26
Our hearts of stone become hearts of flesh when we learn where the outcast weeps.,"Brennan Manning,","compassion, faith, heart, poverty, servanthood",185
"I am the resurrection, and the life: he that believeth in me, though he were dead, yet shall he live: And whosoever liveth and believeth in me shall never die.

(John 11:25-26)","Anonymous,","belief, charles-dickens, ever-after, everlasting-life, faith, paradise, resurrection, sydney-carton, tale-of-two-cities",141
"Faith is not about finding meaning in the world, there may be no such thing -- faith is the belief in our capacity to create meaningful lives.","Terry Tempest Williams,","faith, inspiration, meaning",106
"Perhaps evil is the crucible of goodness... and perhaps even Satan - Satan, in spite of himself - somehow serves to work out the will of God.","William Peter Blatty,",faith,101
"The soul hardly ever realizes it, but whether he is a believer or not, his loneliness is really a homesickness for God.",Hubert Van Zeller,"faith, god, inspirational, life, loneliness, patience",100
"Low self-esteem causes me to believe that I have so little worth that my response does not matter. With repentance, however, I understand that being worth so much to God is why my response is so important. Repentance is remedial work to mend our minds and hearts, which get bent by sin.","John Ortberg,","faith, god, repentance, self-esteem, self-worth, sin, spirituality, worth",98
A God-given longing must have a God-given fulfillment,"Ami Loper,","bible, christian, faith, god, knowledge, love, prayers, prophetic, spiritual, teachings",92
"The human ego is the ugliest part of man. We lift up men who only show us darkness, and put down those brave enough to show us the light. Likewise, people engage in darkness when it is light outside, and acknowledge the light only when it is dark. We abandon those fighting for us to cheer behind those fighting against us. And, we only remember good people and God when it is convenient for us, and take them for granted because their doors are always open - only to chase after closed doors and personalities void of substance and truth.","Suzy Kassem,","beauty, closed-doors, darkness, doors, ego, faith, fighting, god, granted, human-nature, irony, light, men, neglect, people, substance, truth, ugly, void-of-truth",77
"We fall from womb to tomb, from one blackness and toward another, remembering little of the one and knowing nothing of the other ... except through faith.","Stephen King,","birth, death, faith",66
"If you place [your bet] with God, you lose nothing, even if it turns out that God does not exist. But if you place it against God, and you are wrong and God does exist, you lose everything.","Peter Kreeft,","existence, faith, god",66
"Love without hope will not survive.
Love without faith changes nothing.
Love gives power to hope and faith.","Toba Beta,","change, faith, hope, love, power, survive",62
"To believe that what has not occurred in history will not occur at all, is to argue disbelief in the dignity of man.",Mahatma Gandhi,"dignity, faith, history, man",58
He who believes needs no explanation.,"Euripides,",faith,57
"When you aren't sincere you need to pretend, and by pretending you end up believing yourself; that's the basic principle of every faith.","Alberto Moravia,","belief, faith, insincerity, pretense, religion",56
"Faith is accepting what makes no sense, what we cannot prove, but know down deep in our souls is real.","Megan McCafferty,","faith, inspirational",53
"Nobody can turn you into a slave unless you allow them. Nobody can make you afraid of anything, unless you allow them. Nobody can tell you to do something wrong, unless you allow them. God never created you to be a slave, man did. God never created division or set up any borders between brothers, man did. God never told you hurt or kill another, man did. So why is man your god, and not the Creator?","Suzy Kassem,","afraid, border, brotherhood, brothers, conscience, creator, divine-heart, division, ethics, faith, fear, god, hate, human-nature, kill, killing, love, man, peace, religious, right, slave, slavery, truth, unconditional-love, wrong",52
