quote,author,tags,likes
"Dear Human:
You've got it all wrong.

You didn't come here to master unconditional love. This is where you came from and where you'll return.

You came here to learn personal love.
Universal love.
Messy love.
Sweaty Love.
Crazy love.
Broken love.
Whole love.
Infused with divinity.
Lived through the grace of stumbling.
Demonstrated through the beauty of... messing up.
Often.

You didn't come here to be perfect, you already are.

You came here to be gorgeously human. Flawed and fabulous.

And rising again into remembering.

But unconditional love? Stop telling that story.

Love in truth doesn't need any adjectives.
It doesn't require modifiers.
It doesn't require the condition of perfection.

It only asks you to show up.
And do your best.
That you stay present and feel fully.
That you shine and fly and laugh and cry and hurt and heal and fall and get back up and play and work and live and die as YOU.

Its enough.

It's Plenty.",Courtney A. Walsh,"happiness, healing, inspirational, love",243
It’s difficult for me to imagine the rest of my life without you. But I suppose I don’t have to imagine it... I just have to live it,Ranata Suzuki,"always-yours, beautiful, beautiful-quote, break-up-quote, break-ups, breakup, breakup-quote, breakup-quotes, broken-heart, deep-love, deep-love-quotes, deep-thoughts, distance, distance-relationship, feelings, feelings-and-emotions, feelings-of-love, from-a-distance, grief, grief-and-loss, grief-quotes, grieving, heartbreak, heartbreak-quotes, heartbroken, heartbroken-quotes, i-miss-you, loss, loss-of-love, loss-quote, loss-quotes, lost, lost-love, lost-love-quotes, love, love-quotations, love-quote, love-quotes, love-quotes-and-sayings, missing-someone, missing-you-quotes, quote, quotes, ranata-suzuki, ranata-suzuki-quote, sad, sad-quote, sad-quotes, sadness, secret-love, the-one-that-got-away, the-only-one, unrequited, unrequited-love, without-you",241
"love is blind
and lovers cannot see
the pretty follies
that themselves commit","William Shakespeare,",love,238
Whoever debases others is debasing himself.,"James Baldwin,","life, love, racism",237
"Her heart - like every heart, if only its fallen sides were cleared away - was an inexhaustible fountain of love: she loved everything she saw. ","George MacDonald,","heart, love",234
Without love we all like birds with broken wings.,"Mitch Albom,",love,233
"That I shall love always,
I argue thee
that love is life,
and life hath immortality",Emily Dickinson,"life, love",232
You have corrupted my imagination and inflamed my blood...,"Leopold von Sacher-Masoch,","love, passion, sexual",230
"You know what’s a great metaphor for love? Sleeping beauty. Because you have to plow through this incredible thicket of thorns in order to get to beauty, and even then, when you get there, you still have to wake her up.
— Tiny Cooper","David Levithan,",love,230
"What we all want, really, is to be loved. That craving drives our worst behavior.","Jodi Picoult,","craving, desires, love, wants",228
"It was finally becoming clear to her that love wasn't about finding someone perfect to marry. Love was about seeing through to the truth of a person, and accepting all their shades of light and dark. Love was an ability.","Lisa Kleypas,","love, marriage, romance",228
"I only have so much willpower, Helen,"" he whispered. ""And since you apparently sleep in the most ridiculously transparent tank top I've ever seen, I'm going to have to ask you to get under the covers before I do something stupid.","Josephine Angelini,","humorous, love, lucas",228
"I think of how each person in a marriage owes it to the other to find individual happiness, even in a shared life. That this is the only way to grow together, instead of apart.","Emily Giffin,","love, marriage, relationships",227
What a lover’s heart knows let no man’s brain dispute.,"Aberjhani,","famous-author, famous-poet, hope-and-despair, inspiration, inspirational-quotes, intellectualism, intuition, love, lovers, philosophy, spirituality, valentine-s-day, wisdom",226
"A generous heart is always open, always ready to receive our going and coming. In the midst of such love we need never fear abandonment. This is the most precious gift true love offers - the experience of knowing we always belong.","Bell Hooks,","abandonment, belonging, fear, generousity, gift, heart, love, true-love",225
"I once loved a girl who almost loved me, but not as much as she loved John Cusack.","Chuck Klosterman,","humor, love, relationships",222
Sometimes loneliness makes the loudest noise.,Aaron Ben-Ze'ev,"aching-heart, billy-holiday, breakups, central-features, circumstances, comeback, desperation, dwelling, edna-st-vincent-millay, ex-lovers, feelings, hole-in-the-world, imagination, impressive-comeback, intense-desire, love, mental-environment, negative-experiences, nostalgia, phenomenon, reciprocity, romantic-life, scars, st-vincent-millay",365
You can be in love and you can be in a relationship. But they’re not always the same thing.,"pleasefindthis,","being-in-love, love, relationship, relationships",364
"How we need that security. How we need another soul to cling to, another body to keep us warm. To rest and trust; to give your soul in confidence: I need this, I need someone to pour myself into.","Sylvia Plath,","companionship, desire, love, need, security, sylvia-plath, warmth",353
"A competitive and insecure woman will tell you that “true love” is never giving up on someone you're in love with. A confident and spiritual woman knows that “moving on” doesn’t mean you never loved someone. She realizes that letting go is what God needs her to do because both your happiness and hers requires taking different journeys for spiritual growth. Letting go is sometimes the hardest thing, but it is the most “real love” you will ever experience.",Shannon L. Alder,"betrayal, divorcing, ending-it, faith, letting-go, love, moving-on, real-love, sacrifices, see, self-confidence, self-worth, true-love",300
"If anyone were to find out—” I began.

Patch kissed me, hard, but with an amused glint in his eye. “If I get caught, it’ll mean the end of kissing you. Do you really think I’d risk that?” His face grew serious. “I know I can’t feel your touch, but I feel your love, Nora. Inside me. It means everything to me. I wish I could feel you the same way you feel me, but I have your love. Nothing will ever outweigh that. Some people go their entire lives never feeling the emotions you’ve given me. There is no regret in that.","Becca Fitzpatrick,","love, nora, patch",289
A real relationship is two-way.,"Sophie Kinsella,","friendship, love, romance",283
Maybe it's just hiding somewhere. Or gone on a trip to come home. But falling in love is always a pretty crazy thing. It might appear out of the blue and just grab you. Who knows — maybe even tomorrow.,"Haruki Murakami,","falling-in-love, hiding, love, tomorrow, trip",281
"Two minds with but a single thought, two hearts that beat as one.","Jasper Fforde,","comradeship, love",273
"When you say ""I"" and ""my"" too much, you lose the capacity to understand the ""we"" and ""our"".","Steve Maraboli,","inspirational, life, love, relationships, understanding-others",267
"I believe
in love at first sight
but I will always believe
that the people
we love
we have loved before.
Many, many, many times before
and when we stumble
through grace and circumstance
and that brilliant illusion of choice
to finally meet them again,
we feel it faster
each time through.
The one glance
that set life alight
is two sets of two eyes
staring through the layers
of lifetimes and stolen glances
and first kisses and hands held;
the brace against the weight
and unrelenting tide
of waiting.
I believe
in love at first sight
but am not burdened with the misconception
that it's a first sight
at all.",Tyler Knott Gregson,"love, love-at-first-sight, poetry, soul-mate",267
"Love is merely a madness; and, I tell you, deserves as well a dark house and a whip as madmen do; and the reason why they are not so punish'd and cured is that the lunacy is so
ordinary that the whippers are in love too.","William Shakespeare,","insanity, love, madness",264
"For some people, “the point of no return” begins at the very moment their souls become aware of each others’ existence.",C. JoyBell C.,"inspirational-love, inspirational-quotes, love, love-quotes, other-half-of-your-soul, soul-mates, true-love, twin-flames, your-other-half",257
"They were kissing. Put like that, and you could be forgiven for presuming that this was a normal kiss, all lips and skin and possibly even a little tongue. You'd miss how he smiled, how his eyes glowed. And then, after the kiss was done, how he stood, like a man who had just discovered the art of standing and had figured out how to do it better than anyone else who would ever come along.","Neil Gaiman,","kiss, love",254
"I know what I have given you...
I do not know what you have received.",Antonio Porchia,"giving, love, sharing, trade, trading",249
"Often you don't know whether a woman is friend, enemy or lover until it is too late. Sometimes, she is all three.","Robert Jordan,","love, lover, women",247
"Out of the bedroom window, Tara watches the silver moon in the night sky cast a faint glow on the pine trees.  Ian was right.  It’s time to move on.  Not to forget, but to forge ahead.",Dawn Chalker,"accepting, connection, destiny, feelings, finding-yourself, future, love, motivation, moving-on, uplifting",247
"They knew now that if there is one thing one can always yearn for, and sometimes attain, it is human love.","Albert Camus,",love,239
"Love is a game
of tic-tac-toe,
constantly waiting
for the next x or o.",Lang Leav,"langleav, love, poetry, romance",233
He's the one. And some thoughts once thought are very hard to unthink.,"Jandy Nelson,","jude-sweetwine, love, oscar-ralph",230
"Do you think it’s easy for me? No, I don’t remember you. I don’t remember holding you or talking to you or falling in love with you—but I walk around with a giant hole in my heart all the time. I feel your absence every second of the day. It aches and nothing soothes it. Losing you is bad enough, but I don’t even get the comfort of remembering that I had you once.
-Haden","Gwen Hayes,","demon, love, sorrow",227
"True friends will always push you towards the great possibilities of your future, false friends will always chain you to the mistakes in your past.",Seth Brown,"friend, friendship, love, mistakes, truth",227
"Yet, it had been Dimitri’s gentleness and thoughtfulness mixed with that deadliness that made him so wonderful. The same hands that wielded stakes with such precision would carefully brush the hair out of my face. The eyes that could astutely spot any danger in the area would regard me wonderingly and worshipfully, like I was the most beautiful and amazing woman in the world.","Richelle Mead,","blood-promise, dimitri, dimitri-belikov, gentleness, love, rose, rose-hathaway, roza, vampire-academy, wonderful",226
I'm with you. No matter what else you have in your head I'm with you and I love you.,"Ernest Hemingway,",love,225
"Until then, I will continue to love you more and more with every struggle we face than I loved you when all was perfect.","Colleen Hoover,",love,225
Impossible to be alone inside something living & listening. ,"Matthew Edward Hall,","listening, living, love, together, unity",225
"All the fires of hell could burn for a thousand years and it wouldn't equal what I feel for you in one minute of the day. I love you so much there is no pleasure in it. Nothing but torment. Because if I could dilute what I feel for you to the mil­lionth part, it would still be enough to kill you. And even if it drives me mad, I would rather see you live in the arms of that cold, soulless bastard than die in mine,"" Merripen said to Win.","Lisa Kleypas,","love, merripen, museum, win",223
"I worry there is something broken in our generation,
there are too many sad eyes on happy faces.","Atticus Poetry,","atticus, atticus-poetry, atticuspoetry, her, instagram, love, love-her-wild, poems, poetry, quotes, wild",222
"Tell me what to wish for."" Tell me what to ask the sea for.""
""To be happy. Happiness.""
""I don't think such a thing is had on Thisby. And if it is, I don't know how you would keep it.""
""You whisper to it. What it needs to hear. Isn't that what you said?""
""That's what I said. What do I need to hear?""
""That tomorrow we'll rule the Scorpio Races as king and queen of Skarmouth and I'll save the house and you'll have your stallion. Dove will eat golden oats for the rest of her days and you will terrorize the races each year and people will come from every island in the world to find out how it is you get horses to listen to you. The piebald will carry Mutt Malvern into the sea and Gabriel will decide to stay on the island. I will have a farm and you will bring me bread for dinner.""
""That's what I needed to hear.","Maggie Stiefvater,",love,221
"I told you,"" he whispers back. I can feel his breath just tickling the space behind my ear, making my hair prick up on my neck. ""I like you.""
""You don't know me,"" I say quickly.
""I want to, though.","Lauren Oliver,","alex-sheathes, delirium, lauren-oliver, lena-holoway, love",218
"Right now, it's hard to imagine that it is raining anywhere in the world.","Maggie Stiefvater,",love,212
I am supposed to be touched. I can’t wait to find the person who will come into the kitchen just to smell my neck and get behind me and hug me and breathe me in and make me turn around and make me kiss his face and put my hands in his hair even with my soapy dishwater drips. I am a lovely woman. Who will come into my kitchen and be hungry for me?,"Jenny Slate,",love,337
I like being the girl nobody can have.,Miley Cyrus,love,319
The reality of loving God is loving him like he's a Superhero who actually saved you from stuff rather than a Santa Claus who merely gave you some stuff.,"Criss Jami,","apologetics, christ, christmas, god, grace, jesus, love, materialism, mercy, peace, reality, salvation, santa-claus, sin, spirituality, stuff, superhero",310
Every life needs a little space. It leaves room for good things to enter it.,"Sarah Addison Allen,","friendship, love",281
It is very difficult to live among people you love and hold back from offering them advice.,Anne Tyler,"advice, love",277
What sexual preference do you hope she has?” “Happiness.” Isnt that cool?,"Francesca Lia Block,","lgbt, love, sexual-preference, weetzie-bat",258
"When male authors write love stories, the heroine tends to end up dead.","Susan Elizabeth Phillips,","author, authors, books, heroine, love, stories, writers",258
"It's more like you meet someone, and you fall in love, and you hope that that person is the one—and then at some point, you have to put down your chips. You just have to make a commitment and hope that you're right.","Rainbow Rowell,","falling-in-love, love, the-one",253
Love can’t cure a mental illness.,"Alice Oseman,","love, mental-illness",252
The true measure of a man is how he treats you when others are not looking.,Alessandra Torre,"happiness, love, marriage, relationships, relationships-love, respecting-others, respecting-yourself",251
"So, it's not gonna be easy. It's gonna be really hard. We're gonna have to work at this every day, but I want to do that because I want you. I want all of you, forever, you and me, every day. Will you do something for me, please? Just picture your life for me? Thirty years from now, forty years from now? What's it look like? If it's with him- go. Go! I lost you once, I think I can do it again, if I thought that's what you really wanted. But don't you take the easy way out.",Nicholas Sparks,"love, the-notebook",246
Love is the most selfish of all the passions.,"Alexandre Dumas,","love, passions, selfishness",239
"Take any emotion—love for a woman, or grief for a loved one, or what I’m going through, fear and pain from a deadly illness. If you hold back on the emotions—if you don’t allow yourself to go all the way through them—you can never get to being detached, you’re too busy being afraid. You’re afraid of the pain, you’re afraid of the grief. You’re afraid of the vulnerability that loving entails. “But by throwing yourself into these emotions, by allowing yourself to dive in, all the way, over your head even, you experience them fully and completely. You know what pain is. You know what love is. You know what grief is. And only then can you say, ‘All right. I have experienced that emotion. I recognize that emotion. Now I need to detach from that emotion for a moment’.","Mitch Albom,","cognizant, detachment, emotions, grief, life, love, pain, truth, vulnerability",239
"I am the poet of the poor, because I was poor when I loved; since I could not give gifts, I gave words.",Ovid,"love, poetry, words",238
"This isn't a crush, it's obsession.You are never not in my thoughts. Your scent carries across a room and paralyzes me with longing. I don't want to hold your hand. Part of me wants to set you on fire and hold you while the flame consumes us both, to eat your heart so I know that only I possess it entirely.","Gwen Hayes,","crush, love, obsession",238
"I’d missed him so much, it almost hurt. It started the moment I left the Keep and nagged at me all day. Every day I had to fight with myself to keep from making up bullshit reasons to call the Keep so I could hear his voice. My only saving grace was that Curran wasn’t handling this whole mating thing any better. Yesterday he’d called me at the office claiming that he couldn’t find his socks. We talked for two hours.","Ilona Andrews,",love,234
Think of it! We could have gone on longing for one another and pretending not to notice forever. This obsession with dignity can ruin your life if you let it.,"Mary Ann Shaffer,","dignity, love",231
If we only fell in love with people who were perfect for us...then there wouldn't be so much fuss about love in the first place.,"Amor Towles,","love, wisdom",231
"I have loved in life and I have been loved.
I have drunk the bowl of poison from the hands of love as nectar,
and have been raised above life's joy and sorrow.
My heart, aflame in love, set afire every heart that came in touch with it.
My heart has been rent and joined again;
My heart has been broken and again made whole;
My heart has been wounded and healed again;
A thousand deaths my heart has died, and thanks be to love, it lives yet.
I went through hell and saw there love's raging fire,
and I entered heaven illumined with the light of love.
I wept in love and made all weep with me;
I mourned in love and pierced the hearts of men;
And when my fiery glance fell on the rocks, the rocks burst forth as volcanoes.
The whole world sank in the flood caused by my one tear;
With my deep sigh the earth trembled, and when I cried aloud the name of my beloved,
I shook the throne of God in heaven.
I bowed my head low in humility, and on my knees I begged of love,
""Disclose to me, I pray thee, O love, thy secret.""
She took me gently by my arms and lifted me above the earth, and spoke softly in my ear,
""My dear one, thou thyself art love, art lover,
and thyself art the beloved whom thou hast adored.","Hazrat Inayat Khan,","love, sufism",225
"Life is suffering
Love is the desire to see unnecessary suffering ameliorated
Truth is the handmaiden of love
Dialogue is the pathway to truth
Humility is recognition of personal insufficiency and the willingness to learn
To learn is to die voluntarily and be born again, in great ways and small
So speech must be untrammeled
So that dialogue can take place
So that we can all humbly learn
So that truth can serve love
So that suffering can be ameliorated
So that we can all stumble forward to the Kingdom of God",Jordan B. Peterson,"god, humility, inspirational, love, suffering, true",225
You might as well make yourself fly as to make yourself love.,"Marilyn Monroe,","fly, love, marilyn-monroe, my-story",224
What barrier is there that love cannot break?,"Mahatma Gandhi,","gandhi, love",223
"The anticipation and dread he felt at seeing her was also a kind of sensual pleasure, and surrounding it, like an embrace, was a general elation--it might hurt, it was horribly inconvenient, no good might come of it, but he had found out for himself what it was to be in love, and it thrilled him.","Ian McEwan,",love,222
"Real love has little to do with falling. It's a climb up the rocky face of a mountain, hard work, and most people are too selfish or too scared to bother.
Very few reach the critical point in their relationship that summons the attention of the light and the dark, that place where they will make a commitment to love no matter what obstacles-or temptations- appear in their path.","Stacey Jay,","commitment, love, relationship",221
"You are not a perfect woman.You have an evil temper, you’re as blind as a mole, you’re a deplorable poet, and frankly, your French accent could use some work.” Supporting himself on his elbows, Leo took her face in his hands. “But when I put those things together with the rest of you, it makes you into the most perfectly imperfect woman I’ve ever known.","Lisa Kleypas,","hathaway, lisa-kleypas, love",220
"Many, many readers have written asking me wistfully about the nature of Sam and Grace's relationship, and I can assure you, that sort is absolutely real. Mutual, respectful, enduring love is completely attainable as long as you swear you won't settle for less.","Maggie Stiefvater,",love,219
You can’t fool people into loving you.,"Chuck Palahniuk,",love,218
"He kissed me wildly, overwhelming me like a giant wave rushing to shore. I was soon lost in the turbulent grasp of his embrace and yet…I knew I was safe. His wild kiss drove me, pushed me, asked me questions I was unwilling to consider. But I was cherished by this dark Poseidon, and though he had the power to crush me utterly, to drown me in the purple depths of his wake, he held me aloft, separate. His passionate kiss changed. It gentled and soothed and entreated. Together we drifted towards a safe harbor. The god of the sea set me down securely on a sandy beach and steadied me as I trembled. Effervescent tingles shot through my limbs delighting me with surges of sparkling sensation like sandy toes tickled by bubbly waves. Finally, the waves moved away and I felt my Poseidon watching me from a distance. We looked at each other knowing we were forever changed by the experience. We both knew that I would always belong to the sea and that I would never be able to part from it and be whole again.",Colleen Houck,"love, romance",217
This is the part where I kiss you.,"Cynthia Hand,","kiss, love, relationship",215
"We are the ones who take this thing called music and line it up with this thing called time. We are the ticking, we are the pulsing, we are underneath every part of this moment. And by making the moment our own, we are rendering it timeless. There is no audience. There are no instruments. There are only bodies and thoughts and murmurs and looks. It's the concert rush to end all concert rushes, because this is what matters. When the heart races, this is what it's racing towards.","Rachel Cohn,","love, music",210
"how sad and bad and mad it was - but then, how it was sweet",Robert Browning,"love, nostalgia, reflection, the-past",370
"I love you,"" I whisper. ""I love you exactly as you are.","Tahereh Mafi,",love,361
"O, here
Will I set up my everlasting rest,
And shake the yoke of inauspicious stars
From this world-wearied flesh. Eyes, look your last!
Arms, take your last embrace! and, lips, O you
The doors of breath, seal with a righteous kiss
A dateless bargain to engrossing death!","William Shakespeare,","death, kiss, love",354
"Sometimes you know you've got a chance with a girl because she wants to fight with you. If the world wasn't so messed up, it wouldn't be like that. If the world was normal, a girl being nice to you would be a good sign, but in the real world, it isn't.",Nick Hornby,"humour, love, romance",341
"It's risky, falling in love.""

""I know that,"" I answered. ""I've been in love before. It's like a narcotic. At first it brings the euphoria of complete surrender. The next day, you want more. You're not addicted yet, but you like the sensation, and you think you can still control things. You think about the person you love for two minutes, and forget them for three hours.

""But then you get used to that person, and you begin to be completely dependent on them. Now you think about him for three hours and forget him for two minutes. If he's not there, you feel like an addict who can't get a fix. And just as addicts steal and humiliate themselves to get what they need, you're willing to do anything for love.""

""What a horrible way to put it,"" he said.","Paulo Coelho,","love, paulo-coelho",319
"There's only one thing that can heal the heart... Only one... It's love, Gaara.",Masashi Kishimoto,"gaara, heal, heart, love, naruto, one",316
"Marveling at his own boldness, he said softly, ""I would enter your sleep if I could, and guard you there, and slay the thing that hounds you, as I would if it had the courage to face me in fair daylight. But I cannot come in unless you dream of me.","Peter S. Beagle,",love,280
"Love entered in my heart one day
A sad, unwelcome guest.
But when it begged that it might stay
I let it stay and rest

It broke my nights with sorrowing
It filled my heart with fears
And, when my soul was prone to sing,
It filled my eyes with tears.

But...now that it has gone its way,
I miss the dear ole pain.
And, sometimes, in the night I pray
That Love might come again.",J. California Cooper,"heartache, love",275
