quote,author,tags,likes
A friend of mine once defined love as finding someone you can talk to late into the night,James Patterson,love,
"When you like someone, you like them in spite of their faults. When you love someone, you love them with their faults.","Hermann Hesse,",love,584
It’s strange how dreams get under your skin and give your heart a test for what’s real and what’s imaginary.,Jason Mraz,"dreams, imagination, inspirational, jason-mraz, life, love, test, truth",514
"There are so many men, all endlessly attempting to sweep me off my feet. And there is one of you, trying just the opposite. Making sure my feet are firm beneath me, lest I fall.","Patrick Rothfuss,","empathy, freedom, friendship, love, men, respect, women",475
"To wish was to hope, and to hope was to expect","Jane Austen,","expect, expectations, hope, love, wish",465
People wait around too long for love. I'm happy with all of my lusts!,C. JoyBell C.,"happiness, inspirational-attitude, inspirational-life, inspirational-quotes, inspiring, life, life-and-living, living, love, lust, lust-for-everything, lust-for-life, lustful, lusting, lusts, lusty, passion, passionate-life, passionate-living, passions",457
I'm backing down now. I really do love you. That's why I'm doing this.,"Richelle Mead,","love, omg, vampire-academy",445
Hearts Live By Being Wounded,Oscar Wilde,"heart, love, oscar-wilde, wound",440
"Calling it a simple schoolgirl crush was like saying a Rolls-Royce was a vehicle with four wheels, something like a hay-wagon. She did not giggle wildly and blush when she saw him, nor did she chalk his name on trees or write it on the walls of the Kissing Bridge. She simply lived with his face in her heart all the time, a kind of sweet, hurtful ache. She would have died for him..","Stephen King,","love, mania",437
"I would rather a romantic relationship turn into contempt than turn into apathy. The passion in the extremities make it appear as though it once meant something. We grow from hot or cold, but lukewarm is the biggest insult.","Criss Jami,","apathy, breakup, caring, contempt, desire, extreme, hate, hot, love, lukewarm, passion, relationships, romance, scorn, uncaring",437
twice I have lived forever in a smile,E.E. Cummings,"cummings, love, poetry, smiling",434
"If you cannot hold me in your arms, then hold my memory in high regard.
And if I cannot be in your life, then at least let me live in your heart.",Ranata Suzuki,"always-yours, beautiful, beautiful-quote, break-up-quote, break-ups, breakup, breakup-quote, breakup-quotes, broken-heart, deep-love, deep-love-quotes, deep-thoughts, distance, distance-relationship, feelings, feelings-and-emotions, feelings-of-love, from-a-distance, grief, grief-and-loss, grief-quotes, grieving, heartbreak, heartbreak-quotes, heartbroken, heartbroken-quotes, i-miss-you, loss, loss-of-love, loss-quote, loss-quotes, lost, lost-love, lost-love-quotes, love, love-quotations, love-quote, love-quotes, love-quotes-and-sayings, memories, memories-quotes, memory, memory-quote, missing-someone, missing-you-quotes, quote, quotes, ranata-suzuki, ranata-suzuki-quote, reminders, reminisce, reminiscence, reminiscing, sad, sad-quote, sad-quotes, sadness, secret-love, the-one-that-got-away, the-only-one, the-past, unrequited, unrequited-love, without-you",431
"You're a hopeless romantic,"" said Faber. ""It would be funny if it were not serious. It's not books you need, it's some of the things that once were in books. The same things could be in the 'parlor families' today. The same infinite detail and awareness could be projected through the radios, and televisors, but are not. No,no it's not books at all you're looking for! Take it where you can find it, in old phonograph records, old motion pictures, and in old friends; look for it in nature and look for it in yourself. Books were only one type or receptacle where we stored a lot of things we were afraid we might forget. There is nothing magical in them at all. The magic is only in what books say, how they stitched the patches of the universe together into one garment for us. Of course you couldn't know this, of course you still can't understand what I mean when i say all this. You are intuitively right, that's what counts.","Ray Bradbury,","books, fahrenheit-451, knowledge, love, magic",430
How could I be sleeping with this particular man.... Surely only true love could justify my lack of taste.,"Margaret Atwood,","humor, love, relationships",429
A kiss on the beach when there is a full moon is the closest thing to heaven.,H. Jackson Brown Jr.,"kiss, love",424
"If you’re searching for a quote that puts your feelings into words – you won’t find it.
You can learn every language and read every word ever written – but you’ll never find what’s in your heart.
How can you?
He has it.",Ranata Suzuki,"always-yours, beautiful, beautiful-quote, break-up-quote, break-ups, breakup, breakup-quote, breakup-quotes, broken-heart, deep-love, deep-love-quotes, deep-thoughts, feelings, feelings-and-emotions, feelings-of-love, finding-strength, grief, grief-and-loss, grief-quotes, grieving, heartbreak, heartbreak-quotes, heartbroken, heartbroken-quotes, i-miss-you, letting-go, letting-go-quotes, loss, loss-of-love, loss-quote, loss-quotes, lost, lost-love, lost-love-quotes, love, love-quotations, love-quote, love-quotes, love-quotes-and-sayings, memories, memories-quotes, memory, memory-quote, missing-someone, missing-you-quotes, quote, quotes, ranata-suzuki, ranata-suzuki-quote, reminders, reminisce, reminiscence, reminiscing, sad, sad-quote, sad-quotes, sadness, searching, searching-for-answers, searching-for-truth, secret-love, the-one-that-got-away, the-only-one, the-past, unrequited, unrequited-love, without-you",420
That’s love: Two lonely persons keep each other safe and touch each other and talk to each other.,Rainer Maria Rilke,"loneliness, love",417
"What are you doing?”
“Kneeling before a goddess.”
“I’m not a goddess.”
“You are. A goddess, a princess, a queen. As a soldier, I pledge myself to your service. As a prince, I grant you any boon within my power. As a man, I ask to sit at your feet and worship you. Ask me to do anything for you and I will do it.",Colleen Houck,"love, romance",417
"So,"" he called to her back, ""Just out of curiosity, you know, purely conversation and all, at what age will you be entertaining offers of marriage?""

""You think it'll be so easy?"" she called back over her shoulder. ""No way. There will be tasks. Like in a fairy tale.""
""Sounds dangerous.""
""Very, so think twice.""

""No need,"" he said. ""You're worth it.","Laini Taylor,","engagement, humor, love, marriage, proposals",413
"A girl can still admire, can’t she? Even those who can’t afford to go in the store can still window-shop. Right? Knowing he wasn’t for me didn’t mean I couldn’t covet the merchandise.","Colleen Houck,","attractiveness, humor, love, male-beauty, romance, sex-appeal",412
"Get up, Shahrzad al-Khayzuran. You kneel before no one. Least of all me.","Renee Ahdieh,","calipha, khalid, love, love-quotes, lovers, romance",411
"This time I wouldn't forget him, because I couldn't ever forgive him - for breaking my heart twice.","James Patterson,","broken-heart, forgetting, love",410
A man is lucky if he is the first love of a woman. A woman is lucky if she is the last love of a man.,Charles Dickens,"first-love, gender-roles, last-love, love, men, men-and-women, men-mars-women-venus, relationships, women",407
"So many words get lost. They leave the mouth and lose their courage, wandering aimlessly until they are swept into the gutter like dead leaves. On rainy days, you can hear their chorus rushing past: IwasabeautifulgirlPleasedon’tgoItoobelievemybodyismadeofglass-I’veneverlovedanyoneIthinkofmyselfasfunnyForgiveme….

There was a time when it wasn’t uncommon to use a piece of string to guide words that otherwise might falter on the way to their destinations. Shy people carried a little bunch of string in their pockets, but people considered loudmouths had no less need for it, since those used to being overheard by everyone were often at a loss for how to make themselves heard by someone. The physical distance between two people using a string was often small; sometimes the smaller the distance, the greater the need for the string.

The practice of attaching cups to the ends of string came much later. Some say it is related to the irrepressible urge to press shells to our ears, to hear the still-surviving echo of the world’s first expression. Others say it was started by a man who held the end of a string that was unraveled across the ocean by a girl who left for America.

When the world grew bigger, and there wasn’t enough string to keep the things people wanted to say from disappearing into the vastness, the telephone was invented.

Sometimes no length of string is long enough to say the thing that needs to be said. In such cases all the string can do, in whatever its form, is conduct a person’s silence.","Nicole Krauss,","listening, love, poignant",405
"This dangerous girl. This captivating beauty.
This destroyer of worlds and creator of wonder.","Renee Ahdieh,","khalid, love, lovers, shahrzad",403
It's so much easier to convince yourself you're madly in love with someone when you know nothing about him.,"Megan McCafferty,","love, romance",401
"No matter what, nobody can take away the dances you've already had.","Gabriel García Márquez,",love,400
"I have come from the End of the World. From the River of Dreams, through the gauntlet and the Briar and the Deep Wyld, in order to stand before you today. I have but one request—to take my place at your side. To resume my duty as your knight, and to protect you and your kingdom for as long as I draw breath.","Julie Kagawa,",love,399
"You were a summer gift, one I'll always treasure. You were a dream I never wanted to wake up from. You opened my eyes to things I'll never really see. You're the best thing that will ever happen to me.","Ellen Hopkins,",love,395
"His eyes softened. ""But it doesn't change what we are to each other. It's like there's always been a piece of my soul missing, and it's inside you, Clary. I know I told you once that whether God exists or not, we're on our own. But when I'm with you, I'm not.","Cassandra Clare,","clary-fray, jace, love",395
What if love wasn't the act of finding what you were missing but the give-and-take that made you both match?,"Jodi Picoult,",love,392
"when you meet that person. a person. one of your soulmates. let the connection. relationship. be what it is. it may be five mins. five hours. five days. five months. five years. a lifetime. five lifetimes. let it manifest itself the way it is meant to. it has an organic destiny. this way if it stays or if it leaves, you will be softer. from having been loved this authentically. souls come into. return. open. and sweep through your life for a myriad of reasons. let them be who. and what they are meant.",Nayyirah Waheed,"love, nayyirah-waheed, soulmates",496
Love is a possible strength in an actual weakness.,"Thomas Hardy,",love,466
"Whoever loves becomes humble. Those who love have , so to speak , pawned a part of their narcissism.",Sigmund Freud,"change, life, love, personality",464
Nothing had changed. I was the stupid one again. I was the girl who never understood who she was to people.,"Carol Rifka Brunt,","love, unrequited-love",458
"That was the only time, as I stood there, looking at that strange rubbish, feeling the wind coming across those empty fields, that I started to imagine just a little fantasy thing, because this was Norfolk after all, and it was only a couple of weeks since I’d lost him. I was thinking about the rubbish, the flapping plastic in the branches, the shore-line of odd stuff caught along the fencing, and I half-closed my eyes and imagined this was the spot where everything I'd ever lost since my childhood had washed up, and I was now standing here in front of it, and if I waited long enough, a tiny figure would appear on the horizon across the field, and gradually get larger until I'd see it was Tommy, and he'd wave, maybe even call. The fantasy never got beyond that --I didn't let it-- and though the tears rolled down my face, I wasn't sobbing or out of control. I just waited a bit, then turned back to the car, to drive off to wherever it was I was supposed to be.","Kazuo Ishiguro,","loss, love, moving-on",429
"But hurry, let's entwine ourselves as one, our mouth broken, our soul bitten by love, so time discovers us safely destroyed.",Federico Garcia Lorca,"bitten, broken, destroyed, entwine, federico-garcia-lorca, love, mouth, sonnet-of-the-garland-of-roses, soul",423
"I love you, in my mind where my thoughts reside, in my heart where my emotions live, and in my soul where my dreams are born. I love you.","Dee Henderson,","inspirational, love, romantic",422
"The practice of love offers no place of safety. We risk loss, hurt, pain. We risk being acted upon by forces outside our control.","Bell Hooks,","control, force, hurt, loss, love, pain, practice, risk, saftey, security",417
That’s what it feels like when you touch me. Like millions of tiny universes being born and then dying in the space between your finger and my skin. Sometimes I forget.,"Iain Thomas,","love, love-quotes, space, touch, universe",416
Don't let yourself die without knowing the wonder of fucking with love.,Gabriel García Márquez,"fucking, love",414
Let us not seek to satisfy our thirst for freedom by drinking from the cup of bitterness and hatred.,Martin Luther King Jr.,"communism, democracy, freedom, liberation, love, marxism, peace, radicalism, socialism, theology",408
"Along with the idea of romantic love, she was introduced to another--physical beauty. Probably the most destructive ideas in the history of human thought. Both originated in envy, thrived in insecurity, and ended in disillusion.",Toni Morrison,"beauty, disillusion, envy, ideas, insecurity, life, love, physical-beauty, romantic-love, truth",405
One day you fall for this boy. And he touches you with his fingers. And he burns holes in your skin with his mouth. And it hurts when you look at him. And it hurts when you don’t. And it feels like someone’s cut you open with a jagged piece of glass.,"Maureen Medved,","boy, love, lust",405
Love cannot live where there is no trust.,"Edith Hamilton,","cupid, love, mythology, relationships, trust",405
"Then she did something so unexpected Nico would later think he dreamed it. She walked up to Nico, who was standing to one side in the shadows, as usual. She grabbed his hand and pulled him gently into the firelight. ‘We had one home,’ she said. ‘Now we have two.’ She gave Nico a big hug and the crowd roared with approval. For once, Nico didn’t feel like pulling away. He buried his face in Reyna’s shoulder and blinked the tears out of his eyes.","Rick Riordan,","family, love, nico-di-angelo, reyna",402
"It had to be a mad dream, one that would give her the courage she would need to discard the prejudices of a class that had not always been hers but had become hers more than anyone’s. It had to teach her to think of love as a state of grace: not the means to anything but the alpha and omega, an end in itself.","Gabriel Garcia Marquez ,","ageing, aging, love, spirit",401
"Actually, you said Love, for you,
is larger than the usual romantic love. It’s like a religion. It’s
terrifying. No one
will ever want to sleep with you.","Richard Siken,",love,398
"Love is a wonderful gift. It's a present so precious words can barely begin to describe it. Love is a feeling, the deepest and sweetest of all. It's incredibly strong and amazingly gentle at the very same time. It is a blessing that should be counted every day. It is nourishment for the soul. It is devotion, constantly letting each person know how supportive it's certainty can be. Love is a heart filled with affection for the most important person in your life. Love is looking at the special someone who makes your world go around and absolutely loving what you see. Love gives meaning to one's world and magic to a million hopes and dreams. It makes the morning shine more brightly and each season seem like it's the nicest one anyone ever had. Love is an invaluable bond that enriches every good thing in life. It gives each hug a tenderness, each heart a happiness, each spirit a steady lift. Love is an invisible connection that is exquisitely felt by those who know the joy, feel the warmth, share the sweetness, and celebrate the gift! ",Douglas Pagels,love,396
"The key to a successful relationship isn’t just in the words, it’s in the choice of punctuation. When you’re in love with someone, a well-placed question mark can be the difference between bliss and disaster, and a deeply respected period or a cleverly inserted ellipsis can prevent all kinds of exclamations.","David Levithan,",love,396
You can never be wise and be in love at the same time.,Bob Dylan,"bob-dylan, love",394
Love is a state in which a man sees things most decidedly as they are not.,"Nietzsche, Friedrich",love,393
"There are only two reasons why you leave someone you're still in love with - either it's the right thing to do, or it's the only thing to do.","Tiffany Reisz,",love,393
"If you listen to the wind very carefully, you'll be able to hear me whisper my love for you.","Andrew Davidson,","distance, love",392
"When she opened her eyes, she was both in her body and watching it, nowhere near the cavity of the tree. The Blue that was before her stood inches from a boy in an Aglionby sweater. There was a slight stoop to his posture, and his shoulders were spattered darkly with rain. It was his fingers that Blue felt on her face. He touched her cheek with the backs of his fingers.
Tears coursed down the other Blue's face. Though some strange magic, Blue could feel them on her face as well. She could feel, too, sick, rising misery she'd felt in the churchyard, the grief that felt bigger than her. The other Blue's tears seemed endless. One drop slid after another, each following an identical path down her cheeks.
The boy in the Aglionby sweater leaned his forehead against Blue's. She felt the pressure of his skin against hers, and suddenly she could smell mint.
It'll be okay. Gansey told the other Blue. She could tell that he was afraid. It'll be okay.
Impossibly, Blue realized that this other Blue was crying because she loved Gansey. And that the reason Gansey touched her like that, his fingers so careful with her, was because he knew that her kiss could kill him. She could feel how badly the other Blue wanted to kiss him, even as she dreaded it. Though she couldn't understand why, her real, present day memories in the tree cavity were clouded with other false memories of their lips nearly touching, a life this other Blue had already lived.
Okay, I'm ready- Gansey's voice caught, just a little. Blue, kiss me.","Maggie Stiefvater,","kiss, love, sad",392
"...Despite the mayhem that followed, Bruno found that he was still holding Shmuel's hand in his own and nothing in the world would have persuaded him to let go.","John Boyne ,","death, friendship, holocaust, inspirational, life, love, tear-jerker, wwii-fiction",390
I love you with so much of my heart that none is left to protest.,"William Shakespeare,","love, shakespeare",389
"I haven’t been very impressed lately.
By people,
or places,
or the way someone said he loved me and then slowly changed his mind.",Charlotte Eriksson,"alone, breaking-up, change, charlotte-eriksson, growing-up, heart-break, impressed, life, love, mind, moving-on, people, places, poetry, prose, the-glass-child, youth",389
"You are protected, in short, by your ability to love!","J.K. Rowling,","goodness, love",388
The right thing at the wrong tme is the wrong thing.,"Joshua Harris,","inspirational, love, timing",387
"Well my music was different in high school; I was singing about love—you know, things I don't care about anymore.",Lady Gaga,"high-school, lady-gaga, love, music, school",382
I don't think you can define love.,Harry Styles,"cute, harry-styles, love, one-direction",554
"It has made me better loving you... it has made me wiser, and easier, and brighter. I used to want a great many things before, and to be angry that I did not have them. Theoretically, I was satisfied. I flattered myself that I had limited my wants. But I was subject to irritation; I used to have morbid sterile hateful fits of hunger, of desire. Now I really am satisfied, because I can’t think of anything better. It’s just as when one has been trying to spell out a book in the twilight, and suddenly the lamp comes in. I had been putting out my eyes over the book of life, and finding nothing to reward me for my pains; but now that I can read it properly I see that it’s a delightful story.","Henry James,","desire, love, satisfaction",474
I want to be the best version of myself for anyone who is going to someday walk into my life and need someone to love them beyond reason.,"Jennifer Elisabeth,","anxiety, art, beach, born-ready, cape-cod, coming-of-age, constellations, depression, destiny, fate, friends, girls, growing, growing-up, healing, hope, inspiration, jennifer-elisabeth, learning, life, love, lovers, ocean, pray, prayer, red-thread, red-thread-of-destiny, red-thread-of-fate, self-acceptance, self-love, self-reflection, soul, soul-mates, stars, teenagers, teens, time, universe, wish",464
Physical love is unthinkable without violence.,"Milan Kundera,","love, relationships, romance, violence",449
"Thought I couldn't live without you
It's gonna hurt when it heals too
Even though I really love you
I'm gonna smile cause I deserve to
Quickly I'm learning to love again
All I know is I'mma be ok",Leona Lewis,"breakup, couples, heartbreak, love, relationships, sad",415
Love is holy because it is like grace--the worthiness of its object is never really what matters.,"Marilynne Robinson,","grace, holy, love, unearned-blessings, worthy",411
"She loved him. But he didn’t know how to love.
He could talk about love. He could see love and feel love. But he couldn’t give love.
He could make love. But he couldn’t make promises.
She had desperately wanted his promises.
She wanted his heart, knew she couldn’t have it so she took what she could get.
Temporary bliss. Passionate highs and lows. Withdrawal and manipulation.
He only stayed long enough to take what he needed and keep moving.
If he stopped moving, he would self-destruct.
If he stopped wandering, he would have to face himself.
He chose to stay in the dark where he couldn’t see.
If he exposed himself and the sun came out, he’d see his shadow.
He was deathly afraid of his shadow.
She saw his shadow, loved it, understood it. Saw potential in it.
She thought her love would change him.
He pushed and he pulled, tested boundaries, thinking she would never leave.
He knew he was hurting her, but didn’t know how to share anything but pain.
He was only comfortable in chaos. Claiming souls before they could claim him.
Her love, her body, she had given to him and he’d taken with such feigned sincerity, absorbing every drop of her.
His dark heart concealed.
She’d let him enter her spirit and stroke her soul where everything is love and sensation and surrender.
Wide open, exposed to deception.
It had never occurred to her that this desire was not love.
It was blinding the way she wanted him.
She couldn’t see what was really happening, only what she wanted to happen.
She suspected that he would always seek to minimize the risk of being split open, his secrets revealed.
He valued his soul’s privacy far more than he valued the intimacy of sincere connection so he kept his distance at any and all costs.
Intimacy would lead to his undoing—in his mind, an irrational and indulgent mistake.
When she discovered his indiscretions, she threw love in his face and beat him with it.
Somewhere deep down, in her labyrinth, her intricacy, the darkest part of her soul, she relished the mayhem.
She felt a sense of privilege for having such passion in her life.
He stirred her core.
The place she dared not enter.
The place she could not stir for herself.
But something wasn’t right.
His eyes were cold and dark.
His energy, unaffected.
He laughed at her and her antics, told her she was a mess.
Frantic, she looked for love hiding in his eyes, in his face, in his stance, and she found nothing but disdain.
And her heart stopped.","G.G. Renee Hill,","betrayal, dysfunctional-love, heartbreak, love, love-and-romance, manipulation, romance, unrequited-love",410
"She was the kind of girlfriend God gives you young, so you'll know loss the rest of your life.","Junot Díaz,","loss, love",405
الحب هو ذكاء المسافة، ألّا تقترب كثيرًا فتلغي اللهفة، ولا تبتعد طويلًا فتُنسى.,"أحلام مستغانمي,","love, wisdom",404
"How can love be worthy of its name if one selects solely the pretty things and leaves out the hardships? It is easy to enjoy the good and dislike the bad. Anybody can do that. The real challenge is to love the good and the bad together, not because you need to take the rough with the smooth but because you need to go beyond such descriptions and accept love in its entirety.","Elif Shafak,",love,401
