quote,author,tags,likes
"I know I want you,"" he heard himself say, all his vows and his honor all forgotten. She stood before him naked as her name day, and he was as hard as the rock around them. He had been in her half a hundred times by now, but always beneath furs, with others all around them. He had never seeen how beautiful she was. Her legs were skinny and well muscled, the hair at the juncture of her thighs a brighter red than that on her head. Does that make it even luckier? He pulled her close.

""I love the smell of you,"" he said. ""I love your red hair. I love your mouth, and the way you kiss me. I love your smile. I love your teats."" He kissed them, one and then the other. ""I love your skinny legs, and what's between them."" He knelt to kiss her there, lightly on her mound at first, but Ygritte moved her legs apart a little, and he saw the pink inside and kissed that as well, and tasted her.

She gave a little gasp. ""If you love me all so much, why are you still dressed?"" she whispered. ""You know nothing, Jon Snow. Noth---oh. Oh. OHHH.""

Afterward, she was almost shy, or as shy as Ygritte ever got. ""The thing you did,"" she said, when they lay together on their piled clothes. ""With your...mouth."" She hesistated. ""Is that...is it what lordss do to their ladies, down in the south?""

""I don't think so."" No one had ever told Jon just what lords did with their ladies. ""I only...wanted to kiss you there, that's all. You seemed to like it.""

""Aye. I...I liked it some. No one taught you such?""

""There's been no one,"" he confessed. ""Only you.","George R.R. Martin,","jon-snow, kiss, love, romance, sex, ygritte",189
"Other people spoke, and I tried to keep up with the translations. All the stories were about Dimitri's kindness and strength of character. Even when not out battling the undead, Dimitri had always been there to help those who needed it. Almost everyone could recall sometime that Dimitri had stepped up to help others, going out of his way to do what was right, even in situations that could put him at risk. That was no surprise to me. Dimitri always did the right thing.

And it was that attitude that had made me love him so much. I had a similar nature. I too rushed in when others needed me, sometimes when I shouldn't have. Others called me crazy for it, but Dimitri had understood. He'd always understood me, and part of what we'd worked on was how to temper that impulsive need to run into danger with reason and calculation. I had a feeling no one else in this world would ever understand me like he did.","Richelle Mead,","blood-promise, dimitri, love, rose, vampire-academy",184
"I feel the urge, familiar now, to wrench myself from my body and speak directly into her mind. It is the same urge, I realize, that makes me want to kiss her every time I see her, because even a sliver of distance between us is infuriating. Our fingers, loosely woven a moment ago, now clutch together, her palm tacky with moisture, mine rough in places where I have grabbed too many handles on too many moving trains. Now she looks pale and small, but her eyes make me think of wide-open skies that I have never actually seen, only dreamed of.","Veronica Roth,","four, love, tris",183
"I can't promise you an ordinary experience, Kate. I wish I could transform myself into a normal man and be there for you, always, without the trauma that defines my life as ""the walking dead."" Since that isn't possible, I can only reassure you that I will do everything in my power to make it up to you. To give you more than a normal boyfriend could.
I have no idea what that will mean, exactly, but I'm looking forward to finding out. With you.","Amy Plum,",love,181
ما أحلى الكلمات التي لا نقولها عندما نحس أن الحرف عاجز عن إستيعاب انفعالاتنا ,غادة السمان,love,522
God's definition of what matters is pretty straightforward. He measures our lives by how we love.,"Francis Chan,","love, purpose",321
"I made such a fool of myself,” she lamented.
“Love does not make you a fool.”
“He didn’t love me back.”
“That does not make you a fool, either.”
“Just tell me …” Her voice cracked. “When does it stop hurting?”
“Sometimes never.","Mitch Albom,","hurt, love",287
"I am almost a hundred years old; waiting for the end, and thinking about the beginning.

There are things I need to tell you, but would you listen if I told you how quickly time passes?

I know you are unable to imagine this.

Nevertheless, I can tell you that you will awake someday to find that your life has rushed by at a speed at once impossible and cruel. The most intense moments will seem to have occurred only yesterday and nothing will have erased the pain and pleasure, the impossible intensity of love and its dog-leaping happiness, the bleak blackness of passions unrequited, or unexpressed, or unresolved.","Meg Rosoff,","age, death, endings, life, love, passage, passions, time",269
"They were still in the happier stage of love. They were full of brave illusions about each other, tremendous illusions, so that the communion of self with self seemed to be on a plane where no other human relations mattered. They both seemed to have arrived there with an extraordinary innocence as though a series of pure accidents had driven them together, so many accidents that at last they were forced to conclude that they were for each other. They had arrived with clean hands, or so it seemed, after no traffic with the merely curious and clandestine.","F. Scott Fitzgerald,",love,268
Love is like quicksilver in the hand. Leave the fingers open and it stays. Clutch it and it darts away.,Dorothy Parker,love,252
"Sometimes love is a surprise, an instant of recognition, a sudden gift at a sudden moment that makes everything different from then on. Some people will say that's not love, that you can't really love someone you don't know. But, I'm not so sure. Love doesn't seem to follow a plan; it's not a series of steps. It can hit with the force of nature--an earthquake, a tidal wave, a storm of wild relentless energy that is beyond your simple attempts at control.",Deb Caletti,love,250
"They loved each other, not driven by necessity, by the ""blaze of passion"" often falsely ascribed to love. They loved each other because everything around them willed it, the trees and the clouds and the sky over their heads and the earth under their feet.","Boris Pasternak,","love, passion",247
"She remembered who she was
and the game changed.",Lalah Delia,"awakening, divine-mother, divine-strength, do-the-work, doing-the-work, emerging, encouragement, god-is-with-you, god-is-working-in-your-life, growth, inner-strength, inspirational, journey, journey-of-life, lalah-delia, life-path, life-philosophy, life-purpose, love, meditation, minimalism, motivational, philosophy, purposeful-living, rebirth, reemerging, sacred-feminine, self-actualization, self-confidence, self-improvement, self-love, self-mastery, self-realization, spiritual, spirituality, trust-the-journey, trust-the-process",247
What I feel for you can’t be conveyed in phrasal combinations; It either screams out loud or stays painfully silent but I promise — it beats words. It beats worlds.,Katherine Mansfield,love,234
"People fall in love without reason, without even wanting to. You can't predict it. That's love.","Haruki Murakami,",love,223
This is how the girl who couldn't speak and the man who couldn't see fell in love.,"Margaret Atwood,","blind, love, see, speak",220
"...when you decide you want to be with someone forever, you want forever to start right now.","Alexandra Potter,","love, romance",219
"I'll always want him. Until every sun goes dark in every sky, until I am nothing more than long-forgotten cosmic dust, I will want him. And even then I suspect my particles will long for his.","Ann Aguirre,","desire, love",214
Feelings are something you have; not something you are.,Shannon L. Alder,"anger, confusion, emotions, feelings, hate, identity, illness, joy, love, overcoming, paranoia, self, suspician, who-you-are",209
That must be love: when everything else in the world could implode and you wouldn't care as long as you had that one person standing beside you.,"Katie McGarry,",love,202
"Thank you, Mr. Rochester, for your great kindness. I am strangely glad to get back again to you: and wherever you are is my home—my only home.","Charlotte Brontë,","home, love",199
"I heard you were a player , okay , lets play a game.

We'll flirt, play fights, talk 24/7, say goodmorning and goodnight every day, give each other nicknames, hang out, talk on the phone for hours, take cute pictures together, make promises to each other and hold each other.

And whoever falls in love first, loses.",Lyla Tyela Belikov,"cute, fight, flirt, game, heart-broken, lose, love, photo, player, promises, romance, talk",199
"The room fell quiet. And as I read down the list of over one hundred and fifty eight-grade boys, I realized that to me, there had only ever been one boy.","Wendelin Van Draanen,","bhie, bryce-loski, crush, flipped, julie-baker, love, there-had-only-been-you",198
We have only a little time to please the living. But all eternity to love the dead.,"Sophocles,","death, eternity, love",198
"Love is irrational, I reminded myself. The more you loved someone, the less sense anything made.","Stephenie Meyer,",love,197
"Disappointments in love, even betrayals and losses, serve the soul at the very moment they seem in life to be tragedies. The soul is partly in time and partly in eternity. We might remember the part that resides in eternity when we feel despair over the part that is in life.","Thomas Moore,","betrayal, disappointment, love, soul, tragedies",196
"Like time suspended,
a wound unmended--
you and I.

We had no ending,
no said goodbye;

For all my life,
I'll wonder why.","Lang Leav,","closure, love",195
It's true that nothing in this world makes us so necessary to others as the affection we have for them.,"Johann Wolfgang von Goethe,","affection, love, necessity",194
"Ruby: ...What's so good about being 20? I call them the materialist years. The years we get distracted by all the bullshit. Then we cop on when we hit our 30s and spend those years trying to make up for the 20s. But your 40s? Those years are for enjoying it.

Rosie: Hmmm good point. What are the 50s for?

Ruby: Fixing what you fucked up in your 40s.

Rosie: Great. Looking forward to it.","Cecelia Ahern,","love, rosie",192
"...in matters of feeling and of the heart, too much is always better than too little.","Jose Saramago,",love,191
I guess the sacrifice of my dignity is the only thing that will save us now. The things I endure for love. The Fates laugh at my torment.,"Julie Kagawa,","humor, love",189
"For many, love is a two-sided coin. It can strengthen or stifle, expand or enfeeble, perfect or pauperize. When love is returned, we soar. We are taken to heights unseen, where it delights, invigorates, and beautifies. When love is spurned, we feel crippled, disconsolate, and bereaved. Polish the coin and you will see only requited love on both sides. I was destined to love you and I will belong to you forever.",Colleen Houck,"love, romance",188
"Dimitri's voice snapped my attention back to him. ""That's Adrian Ivashkov."" He said the name the same way everyone else did.
""Yeah, I know.""
""This is the second time I've seen you with him.""
""Yeah,"" I replied glibly. ""We hang out sometimes.""
Dimitri arched an eyebrow, then jerked his head back toward where we'd come from. ""You hang out in his room a lot?""
Several retorts popped into my head, and then a golden one took precedence. ""What happens between him and me is none of your business."" I managed a tone very similar to the one he'd used on me when making a similar comment about him and Tasha.
""Actually, as long as you're at the Academy, what you do is my business.""
""Not my personal life. You don't have any say in that.","Richelle Mead,","dimitri-belikov, love, rose-hathaway, vampire-academy",187
"An honorable human relationship – that is, one in which two people have the right to use the word ""love"" – is a process, delicate, violent, often terrifying to both persons involved, a process of refining the truths they can tell each other.

It is important to do this because it breaks down human self-delusion and isolation.

It is important to do this because in doing so we do justice to our own complexity.

It is important to do this because we can count on so few people to go that hard way with us.","Adrienne Rich,","human, love, relationships",183
"You can love somebody without it being like that. You keep them a stranger, a stranger who's a friend.","Truman Capote,","friendship, love, stranger",375
"There is no perfection, only beautiful versions of brokenness.",Shannon L. Alder,"beautiful, broken, brokeness, change, connection, growing, learning, living, love, loving, perfection, perfectionism, seeing-people, souls, transformation, understanding",315
"No … because they are just husbands. I am Evelyn Hugo. And anyways, I think once people know the truth, they will be much more interested in my wife.","Taylor Jenkins Reid,","lesbian, love",289
"صديقي..
الذي تحوّلَ إلى عدوِّي فجأة..
بلا سببٍ تحوَّل!
رغم أني لم أكُن سببًا في عداوته!
ولا أعرفُ ما الدّاعي من غضبهِ وتحوّله..
إنك عالقٌ في رأسي على شكلكَ القَديم..
شكلكَ وأنت صَديقي!","رشاد حسن,","friendship, love",252
"The purpose of relationship is not to have another who might complete you, but to have another with whom you might share your completeness.",Neale Donald Walsch,love,251
"My life-my whole life- take it, and do with it what you will. I love you-love you as I have never loved any living thing. From the moment I met you I loved you, loved you blindly, adoringly,madly!

You didn't know it then-you know it now.","Oscar Wilde,",love,247
"Some people are born with tornadoes in their lives, but constellations in their eyes. Other people are born with stars at their feet, but their souls are lost at sea.",Nikita Gill,"constellations, dream-big, life, love, nikitagill, perspectives, stars",237
"Buy a gift for a dog, and you'll be amazed at the way it will dance and swerve its tail, but if don't have anything to offer to it, it won't even recognize your arrival; such are the attributes of fake friends.",Michael Bassey Johnson,"attraction, bad, bad-people, bait, cheat, cheaters, cheating, corrosive, devil, devilish, dog, dogs, evil, fake-friends, false-colour, fools, gift, hate, haters, hatred, love, michael-bassey-johnson, negative, negative-people, negativity, pretence, pretension, sycophants, trick, trickish, tricky, wolves",235
Her existence alone was excuse enough to justify the creation of the entire world.,Stephenie Meyer,"bella, edward, love, midnight-sun",234
"I think given the choice between loving Mare - betrayal included - and never knowing her, I'd chose love. I risked, and I lost, but the risk was still worth it.","Brandon Sanderson,","betrayal, love, risk",228
"Soul, if you want to learn secrets,
your heart must forget about
shame and dignity.
You are God's lover,
yet you worry
what people
are saying.","Rumi,","heart, identity, love, rumi, shame",228
"The night has a thousand eyes,
And the day but one;
Yet the light of the bright world dies
With the dying sun.

The mind has a thousand eyes,
And the heart but one:
Yet the light of a whole life dies
When love is done.",Francis William Bourdillon,"love, poetry",227
You don’t think monster girls and wicked boys deserve love?,"Holly Black,","cardan-greenbriar, love, monsters, stories, villains",227
She had just enough madness to make her interesting,"Atticus Poetry,","atticus, atticus-poetry, atticuspoetry, her, instagram, love, love-her-wild, poems, poetry, quotes, wild",224
I knew exactly what kind of effort I was going to need to get where I wanted to go.,Vernon Davis,"experiences, family, influence, journey, life, love, management, motivating, resilience, self-healing",224
"There was a time when I thought I loved my first wife more than life itself. But now I hate her guts. I do. How do you explain that? What happened to that love? What happened to it, is what I'd like to know. I wish someone could tell me.","Raymond Carver,","break-up, divorce, falling-out, hate, love, love-to-hate, questioning",221
"I wanted to see the place where Margaret grew to what she is, even at the worst time of all, when I had no hope of ever calling her mine.","Elizabeth Gaskell,","hope, love, unrequited-love",218
"No, I do not want to be loved unconditionally. I want to be shown when I am treating you less than you deserve. I want you to leave if I ever start making you promises I do not see through. Love me for my flaws, yes, but don’t you dare ever allow them to hurt you.",Beau Taplin,"love, unconditional-love",214
"So shut up, live, travel, adventure, bless and don't be sorry","Jack Kerouac,","adventure, awakening, life, love, travel",202
"Dear friend, You are not a freak. You are wanted. You are necessary. You are the only you there is. Don’t be afraid to leave the castle. It’s a great big world out there. Love, a fellow reader","Jennifer Niven,","afraid, dear-friend, freak, love, reader",202
"It's the time you spent on your rose that makes your rose so important...People have forgotten this truth, but you mustn't forget it. You become responsible forever for what you've tamed. You're responsible for your rose.","Antoine de Saint-Exupéry,","heart, love, rose",200
"If Jack's in love, he's no judge of Jill's beauty.",Benjamin Franklin,"beauty, love, sex",196
"I hold the bottle out into the rain and watch as the steady flow slowly fills it. When there is enough, enough that Beth can clearly see, I close the bottle and hand it to her.

She raises a skeptical eyebrow, but accepts the bottle.

""It's our rain Beth.""

Her head barely shakes to show her confusion while I rub the back of my neck and search for my courage. ""I told you I loved you in this rain and when you doubt my words, I want you to look at this bottle.","Katie McGarry,","love, ryan-and-beth",189
"Love is like a good cake; you never know when it's coming, but you'd better eat it when it does!",C. JoyBell C.,"cake, inspirational, inspirational-life, inspirational-love, inspirational-quotes, love, true-love",188
"And sometimes I believe your relentless analysis of June leaves something out, which is your feeling for her beyond knowledge, or in spite of knowledge. I often see how you sob over what you destroy, how you want to stop and just worship; and you do stop, and then a moment later you are at it again with a knife, like a surgeon.
What will you do after you have revealed all there is to know about June? Truth. What ferocity in your quest of it. You destroy and you suffer. In some strange way I am not with you, I am against you. We are destined to hold two truths. I love you and I fight you. And you, the same. We will be stronger for it, each of us, stronger with our love and our hate. When you caricature and nail down and tear apart, I hate you. I want to answer you, not with weak or stupid poetry but with a wonder as strong as your reality. I want to fight your surgical knife with all the occult and magical forces of the world.","Anais Nin,","hate, love, magic, science",187
"All she had needed was the certainty of his love, and his reassurance that there was no hurry when a lifetime lay ahead of them.","Ian McEwan,",love,187
"You have within you,right now,everything you need to deal with whatever the world can throw at you.",Brian Tracy,"future, inspiring, love",187
"It's a very brave thing to fall in love. You have to be willing to trust somebody else with your whole being, and that's very difficult, really difficult and very brave.",Nicole Kidman,love,184
Home is where you are. I would go anywhere for you if you wanted me there.,"Mariana Zapata ,","love, romance",184
"There are very few friends that will lie down with you on empty streets in the middle of the night, without a word. No questions, no asking why, just quietly lay there with you, observing the stars, until you're ready to get back up on your feet again and walk the last bit home, softly holding your hand as a quiet way of saying “I'm here”.
It was a beautiful night.","Charlotte Eriksson,","alive, empty-streets, free, friendship, love, night, prose, quiet, stars, thoughts, youth",183
"Love is like the sea. It's a moving thing, but still and all, it takes its shape from the shore it meets, and it's different with every shore.","Zora Neale Hurston,",love,413
"I asked you here tonight because when you realise you want to spend the rest of your life with somebody, you want the rest of your life to start as soon as possible.","Graeme Simsion,","cute, love, truth",344
"Sometimes I think gravity may be death in disguise. Other times I think gravity is love, which is why love's only demand is that we fall.","Shaun David Hutchinson,","aliens, death, gravity, love, teens, ya",315
The Fate didn’t move. He didn’t let the girl go. He looked as if he never would. He continued holding her as if he could return her to life with the force of his will. His eyes were wet with blood. Red tears fell down his cheeks and onto hers. But the girl didn’t stir.,"Stephanie Garber,","evajacks, evangeline-fox, grief, jacks, love, pain, prince-of-hearts",230
I loved him as we always love for the first time; with idolatry and wild passion.,Candide,"love, passion",221
"Love doesn't give you very many choices. When you love someone, you just want to be with them. If they break your heart, you will still love them. Because hearts are easy to break, and though love is tender and sometimes fragile, love isn't.

Love sort of envelops you. It covers you like a giant shadow, then pulls you in like a blanket. You are so warm. The feeling surrounds you, and no matter how you feel, it is always there. You can't escape it. But you wouldn't want to. You are so, so safe. You can't remember the last time you were this happy. Were you ever? This happy?

Every second you are apart feels like hours. Sometimes, right before you fall asleep, you miss them so much it hurts. You ache for them. Their warmth. Their touch. Their smell. You need them. When you can't sleep you wish and wish and wish that they would wake up and talk to you. When you dream of them, you wake up smiling. When pain stabs into you, you reach out for them. You cry to them, begging them to hold you and make it all go away, make everything go away.

Love addicts you to its feeling. You never, ever want to lose that feeling. Sometimes the fear of losing love drives people to do crazy things. Like buy a plane ticket. Make a phone call. Run out of a class. Cry. Write. Laugh.

Because when you love someone, you really love them. You give them your whole heart. You trust them. You never want to be away from them. Sometimes, you don't even need their words. You just need them there.

Love is such an amazing thing, and too many people take it for granted. If you're in love, don't let it go. Don't you dare let it go.",Alysha Speer,"life, love",216
"In any relationship, there will be frightening spells in which your feelings of love dry up. And when that happens you must remember that the essence of marriage is that it is a covenant, a commitment, a promise of future love. So what do you do? You do the acts of love, despite your lack of feeling. You may not feel tender, sympathetic, and eager to please, but in your actions you must BE tender, understanding, forgiving and helpful. And, if you do that, as time goes on you will not only get through the dry spells, but they will become less frequent and deep, and you will become more constant in your feelings. This is what can happen if you decide to love.","Timothy Keller,","love, marriage, passion",216
"The greatest thing a father can do for his children is to respect the woman that gave birth to his children. It is because of her that you have the greatest treasures in your life. You may have moved on, but your children have not. If you can’t be her soulmate, then at least be thoughtful. Whom your children love should always be someone that you acknowledge with kindness. Your children notice everything and will follow your example.","Shannon L. Alder,","children, children-s-feelings, choices, christlike, christlike-behavior, coparenting, dad, families-are-forever, fathers, honesty, honor, honorable, kindness, love, mom, mothers, positive-choices, positive-living, positive-outlooks, respect, respectable, respecting-others, staying-positive, thoughtful, thoughtlessness, unconditional-love",216
"You know not, yet, the sort of love that strikes like a lightning bolt; that clutches hold of you by the heart, as irrevocably as death; that becomes the lodestar by which you steer the rest of your life. I would not wish such a love on anyone, man or woman, for it can make your life a paradise, or it can destroy you utterly.","Juliet Marillier,",love,210
