quote,author,tags,likes
Be yourself; everyone else is already taken.,Oscar Wilde," be-yourself, gilbert-perreira, honesty, inspirational, misattributed-oscar-wilde, quote-investigator",174965
"I'm selfish, impatient and a little insecure. I make mistakes, I am out of control and at times hard to handle. But if you can't handle me at my worst, then you sure as hell don't deserve me at my best.",Marilyn Monroe," best, life, love, misattributed-marilyn-monroe, mistakes, out-of-control, truth, worst",164216
"So many books, so little time.",Frank Zappa,"books, humor",149724
Two things are infinite: the universe and human stupidity; and I'm not sure about the universe.,Albert Einstein," human-nature, humor, infinity, philosophy, science, stupidity, universe",147421
A room without books is like a body without a soul.,Marcus Tullius Cicero," books, simile, soul",134623
"Be who you are and say what you feel, because those who mind don't matter, and those who matter don't mind.",Bernard M. Baruch,"ataraxy, be-yourself, confidence, fitting-in, individuality, misattributed-dr-seuss, those-who-matter",129476
"You've gotta dance like there's nobody watching,
Love like you'll never be hurt,
Sing like there's nobody listening,
And live like it's heaven on earth.",William W. Purkey,"dance, heaven, hurt, inspirational, life, love, sing",128142
You know you're in love when you can't fall asleep because reality is finally better than your dreams.,Dr. Seuss," dreams, love, reality, sleep",126252
"You only live once, but if you do it right, once is enough.",Mae West,"humor, life",118334
Be the change that you wish to see in the world.,Mahatma Gandhi,"action, change, inspirational, misattributed-to-gandhi, philosophy, wish",113833
In three words I can sum up everything I've learned about life: it goes on.,Robert Frost,life,108773
"If you want to know what a man's like, take a good look at how he treats his inferiors, not his equals.","J.K. Rowling,",charles-bayard-mitchell,101337
"Don’t walk in front of me… I may not follow
Don’t walk behind me… I may not lead
Walk beside me… just be my friend",Albert Camus," friends, friendship, misattributed-albert-camus",93020
"If you tell the truth, you don't have to remember anything.",Mark Twain,"lies, lying, memory, truth",91646
"I've learned that people will forget what you said, people will forget what you did, but people will never forget how you made them feel.",Maya Angelou,,88350
"Friendship ... is born at the moment when one man says to another ""What! You too? I thought that no one but myself . . .","C.S. Lewis,",friendship,87867
"To live is the rarest thing in the world. Most people exist, that is all.",Oscar Wilde,,84236
A friend is someone who knows all about you and still loves you.,Elbert Hubbard,,84049
Always forgive your enemies; nothing annoys them so much.,Oscar Wilde," enemies, forgiveness, strategy",81443
Darkness cannot drive out darkness: only light can do that. Hate cannot drive out hate: only love can do that.,"Martin Luther King Jr.,","darkness, drive-out, hate, inspirational, light, love, peace",77954
Live as if you were to die tomorrow. Learn as if you were to live forever.,Mahatma Gandhi,"carpe-diem, education, inspirational, learning",77451
We accept the love we think we deserve.,"Stephen Chbosky,","inspirational, love",75858
"Without music, life would be a mistake.","Friedrich Nietzsche,","inspirational, music, philosophy",73917
I am so clever that sometimes I don't understand a single word of what I am saying.,"Oscar Wilde,","intelligence, self-deprecation",71457
To be yourself in a world that is constantly trying to make you something else is the greatest accomplishment.,Ralph Waldo Emerson,"accomplishment,  be-yourself, conformity, individuality",69429
"Here's to the crazy ones. The misfits. The rebels. The troublemakers. The round pegs in the square holes. The ones who see things differently. They're not fond of rules. And they have no respect for the status quo. You can quote them, disagree with them, glorify or vilify them. About the only thing you can't do is ignore them. Because they change things. They push the human race forward. And while some may see them as the crazy ones, we see genius. Because the people who are crazy enough to think they can change the world, are the ones who do.",Steve Jobs,,67995
"Insanity is doing the same thing, over and over again, but expecting different results.",Narcotics Anonymous,"humor, insanity, life, misattributed-ben-franklin, misattributed-mark-twain, misattributed-to-einstein",64461
"I believe that everything happens for a reason. People change so that you can learn to let go, things go wrong so that you appreciate them when they're right, you believe lies so you eventually learn to trust no one but yourself, and sometimes good things fall apart so better things can fall together.",Marilyn Monroe, misattributed-marilyn-monroe,61993
It is better to be hated for what you are than to be loved for what you are not.,"Andre Gide,","life, love",61726
Twenty years from now you will be more disappointed by the things that you didn't do than by the ones you did do. So throw off the bowlines. Sail away from the safe harbor. Catch the trade winds in your sails. Explore. Dream. Discover.,"H. Jackson Brown Jr.,","actions, disappointed, disappointment, dream, dreams, explore, misattributed-mark-twain, sail",60030
"Only once in your life, I truly believe, you find someone who can completely turn your world around. You tell them things that you’ve never shared with another soul and they absorb everything you say and actually want to hear more. You share hopes for the future, dreams that will never come true, goals that were never achieved and the many disappointments life has thrown at you. When something wonderful happens, you can’t wait to tell them about it, knowing they will share in your excitement. They are not embarrassed to cry with you when you are hurting or laugh with you when you make a fool of yourself. Never do they hurt your feelings or make you feel like you are not good enough, but rather they build you up and show you the things about yourself that make you special and even beautiful. There is never any pressure, jealousy or competition but only a quiet calmness when they are around. You can be yourself and not worry about what they will think of you because they love you for who you are. The things that seem insignificant to most people such as a note, song or walk become invaluable treasures kept safe in your heart to cherish forever. Memories of your childhood come back and are so clear and vivid it’s like being young again. Colours seem brighter and more brilliant. Laughter seems part of daily life where before it was infrequent or didn’t exist at all. A phone call or two during the day helps to get you through a long day’s work and always brings a smile to your face. In their presence, there’s no need for continuous conversation, but you find you’re quite content in just having them nearby. Things that never interested you before become fascinating because you know they are important to this person who is so special to you. You think of this person on every occasion and in everything you do. Simple things bring them to mind like a pale blue sky, gentle wind or even a storm cloud on the horizon. You open your heart knowing that there’s a chance it may be broken one day and in opening your heart, you experience a love and joy that you never dreamed possible. You find that being vulnerable is the only way to allow your heart to feel true pleasure that’s so real it scares you. You find strength in knowing you have a true friend and possibly a soul mate who will remain loyal to the end. Life seems completely different, exciting and worthwhile. Your only hope and security is in knowing that they are a part of your life.",Bob Marley,love,57746
"All that is gold does not glitter,
Not all those who wander are lost;
The old that is strong does not wither,
Deep roots are not reached by the frost.

From the ashes a fire shall be woken,
A light from the shadows shall spring;
Renewed shall be blade that was broken,
The crownless again shall be king.","J.R.R. Tolkien,","frost, glitter, gold, lost, poetry, roots, strength, strong, wander, wither",57720
"The person, be it gentleman or lady, who has not pleasure in a good novel, must be intolerably stupid.","Jane Austen,","aliteracy, books, classic, humor",51386
"It is our choices, Harry, that show what we truly are, far more than our abilities.","J.K. Rowling,",abilities,50685
"Imperfection is beauty, madness is genius and it's better to be absolutely ridiculous than absolutely boring.",Marilyn Monroe," be-yourself, inspirational",49897
There are only two ways to live your life. One is as though nothing is a miracle. The other is as though everything is a miracle.,Albert Einstein," inspirational, life, live, miracle, miracles",49731
It does not do to dwell on dreams and forget to live.,"J.K. Rowling,","dreams, life",48307
"Good friends, good books, and a sleepy conscience: this is the ideal life.",Mark Twain,"books, contentment, friends, friendship, life",47001
"As he read, I fell in love the way you fall asleep: slowly, and then all at once.","John Green,",love,46964
"We are all in the gutter, but some of us are looking at the stars.","Oscar Wilde,","inspirational, optimism, perception, pessimism",46263
"Fairy tales are more than true: not because they tell us that dragons exist, but because they tell us that dragons can be beaten.","Neil Gaiman,","books, dragons, fairy-tales, inspirational, paraphrasing-g-k-chesterton",45298
"The fool doth think he is wise, but the wise man knows himself to be a fool.","William Shakespeare,",wisdom,45127
"It is better to remain silent at the risk of being thought a fool, than to talk and remove all doubt of it.","Maurice Switzer,","misattributed-to-abraham-lincoln, misattributed-to-mark-twain, remaining-silent, wisdom",44296
"Whenever you find yourself on the side of the majority, it is time to reform (or pause and reflect).",Mark Twain,"individuality, majority, minority, pause, reflect, wisdom",43836
Life is what happens to us while we are making other plans.,Allen Saunders,"fate, life, misattributed-john-lennon, planning, plans",43603
"Yesterday is history, tomorrow is a mystery, today is a gift of God, which is why we call it the present.",Bill Keane," hope, inspirational, misattributed-eleanor-roosevelt, past, present, widely-misattributed",42630
"I have not failed. I've just found 10,000 ways that won't work.",Thomas A. Edison,"edison, failure, inspirational, paraphrased",42194
"It is not a lack of love, but a lack of friendship that makes unhappy marriages.",Friedrich Nietzsche,"friendship, lack-of-friendship, lack-of-love, love, marriage, unhappy-marriage",42190
"The opposite of love is not hate, it's indifference. The opposite of art is not ugliness, it's indifference. The opposite of faith is not heresy, it's indifference. And the opposite of life is not death, it's indifference.",Elie Wiesel,"activism, apathy, hate, indifference, inspirational, love, opposite, philosophy",41838
The man who does not read has no advantage over the man who cannot read.,Mark Twain,"aliteracy,  literacy",40878
A woman is like a tea bag; you never know how strong it is until it's in hot water.,Eleanor Roosevelt, misattributed-eleanor-roosevelt,40731
"I love you without knowing how, or when, or from where. I love you simply, without problems or pride: I love you in this way because I do not know any other way of loving but this, in which there is no I or you, so intimate that your hand upon my chest is my hand, so intimate that when I fall asleep your eyes close.","Pablo Neruda,","love, poetry",39707
"I may not have gone where I intended to go, but I think I have ended up where I needed to be.","douglas adams,","life, navigation",39185
"Outside of a dog, a book is man's best friend. Inside of a dog it's too dark to read.","Groucho Marx,","animals, books, dogs, friends, humor",37934
I am enough of an artist to draw freely upon my imagination. Imagination is more important than knowledge. Knowledge is limited. Imagination encircles the world.,Albert Einstein,"1929, viereck-interview",37538
I solemnly swear that I am up to no good.,"J.K. Rowling,",mischief,37500
"Love all, trust a few,
Do wrong to none: be able for thine enemy
Rather in power than use; and keep thy friend
Under thy own life's key: be check'd for silence,
But never tax'd for speech.","William Shakespeare,","do-wrong, love, trust, wrong",37068
Have you ever been in love? Horrible isn't it? It makes you so vulnerable. It opens your chest and it opens up your heart and it means that someone can get inside you and mess you up.,"Neil Gaiman,",love,36831
"I like nonsense, it wakes up the brain cells. Fantasy is a necessary ingredient in living.",Dr. Seuss,fantasy,36787
"A reader lives a thousand lives before he dies, said Jojen. The man who never reads lives only one.","George R.R. Martin,","read, readers, reading, reading-books",35462
"A day without sunshine is like, you know, night.",Steve Martin,"humor, obvious, simile",35238
"Being deeply loved by someone gives you strength, while loving someone deeply gives you courage.",Lao Tzu,"courage, deeply-loved, love, strength, widely-misattributed",34655
Never put off till tomorrow what may be done day after tomorrow just as well.,Mark Twain,,34475
" The Paradoxical Commandments

People are illogical, unreasonable, and self-centered.
Love them anyway.

If you do good, people will accuse you of selfish ulterior motives.
Do good anyway.

If you are successful, you will win false friends and true enemies.
Succeed anyway.

The good you do today will be forgotten tomorrow.
Do good anyway.

Honesty and frankness make you vulnerable.
Be honest and frank anyway.

The biggest men and women with the biggest ideas can be shot down by the smallest men and women with the smallest minds.
Think big anyway.

People favor underdogs but follow only top dogs.
Fight for a few underdogs anyway.

What you spend years building may be destroyed overnight.
Build anyway.

People really need help but may attack you if you do help them.
Help people anyway.

Give the world the best you have and you'll get kicked in the teeth.
Give the world the best you have anyway.","Kent M. Keith,","forgiveness, goodness, happiness, honesty, kindness, misattributed-to-mother-teresa, world",34284
That which does not kill us makes us stronger.,Friedrich Nietzsche,"paraphrased, strength",33964
You have brains in your head. You have feet in your shoes. You can steer yourself any direction you choose. You're on your own. And you know what you know. And YOU are the one who'll decide where to go...,"Dr. Seuss,",inspirational,33838
It is never too late to be what you might have been.,George Eliot,"inspirational, misattributed, source-unknown",33734
For every minute you are angry you lose sixty seconds of happiness.,Ralph Waldo Emerson,happiness,32889
"This life is what you make it. No matter what, you're going to mess up sometimes, it's a universal truth. But the good part is you get to decide how you're going to mess it up. Girls will be your friends - they'll act like it anyway. But just remember, some come, some go. The ones that stay with you through everything - they're your true best friends. Don't let go of them. Also remember, sisters make the best friends in the world. As for lovers, well, they'll come and go too. And baby, I hate to say it, most of them - actually pretty much all of them are going to break your heart, but you can't give up because if you give up, you'll never find your soulmate. You'll never find that half who makes you whole and that goes for everything. Just because you fail once, doesn't mean you're gonna fail at everything. Keep trying, hold on, and always, always, always believe in yourself, because if you don't, then who will, sweetie? So keep your head high, keep your chin up, and most importantly, keep smiling, because life's a beautiful thing and there's so much to smile about.",Marilyn Monroe," friends, heartbreak, inspirational, life, love, sisters",32392
"It takes a great deal of bravery to stand up to our enemies, but just as much to stand up to our friends.","J.K. Rowling,","albus-dumbledore, courage, friends",32173
I love deadlines. I love the whooshing noise they make as they go by.,"Douglas Adams,","deadlines, humor, humour, work, writing",32105
"I'm not upset that you lied to me, I'm upset that from now on I can't believe you.",Friedrich Nietzsche,"lies, lying, trust",31464
There is no greater agony than bearing an untold story inside you.,"Maya Angelou,","1970, inspirational, stories, writing",31399
"If you judge people, you have no time to love them.",Mother Teresa,attributed-no-source,31341
"There is never a time or place for true love. It happens accidentally, in a heartbeat, in a single flashing, throbbing moment.","Sarah Dessen,",love,31240
"If you can't explain it to a six year old, you don't understand it yourself.",Albert Einstein," simplicity, understand",31173
"If you only read the books that everyone else is reading, you can only think what everyone else is thinking.","Haruki Murakami,","books, thought",31080
Love is that condition in which the happiness of another person is essential to your own.,"Robert A. Heinlein,","essential, happiness, love",30754
Anyone who thinks sitting in church can make you a Christian must also think that sitting in a garage can make you a car.,Garrison Keillor,"humor, religion",30165
Everything you can imagine is real.,Pablo Picasso,"art, imagination, inspirational, life",29872
I have always imagined that Paradise will be a kind of library.,Jorge Luis Borges,"books, library",29730
"Women and cats will do as they please, and men and dogs should relax and get used to the idea.",Robert A. Heinlein,"cats, humor, women",28758
"We don't see things as they are, we see them as we are.",Anaïs Nin,,28700
"You love me. Real or not real?""
I tell him, ""Real.","Suzanne Collins,","katniss, love, peeta, suzanne-collins, the-hunger-games",28370
"You may not be her first, her last, or her only. She loved before she may love again. But if she loves you now, what else matters? She's not perfect—you aren't either, and the two of you may never be perfect together but if she can make you laugh, cause you to think twice, and admit to being human and making mistakes, hold onto her and give her the most you can. She may not be thinking about you every second of the day, but she will give you a part of her that she knows you can break—her heart. So don't hurt her, don't change her, don't analyze and don't expect more than she can give. Smile when she makes you happy, let her know when she makes you mad, and miss her when she's not there.",Bob Marley,love,28323
Sometimes the questions are complicated and the answers are simple.,Dr. Seuss,attributed-no-source,28119
You can never get a cup of tea large enough or a book long enough to suit me.,C.S. Lewis,"books, inspirational, reading, tea",27819
Never trust anyone who has not brought a book with them.,"Lemony Snicket,","books, reading",27723
Life isn't about finding yourself. Life is about creating yourself.,George Bernard Shaw,"inspirational, life, yourself",27105
We read to know we're not alone.,"William Nicholson,","misattributed-to-c-s-lewis, reading",26981
"Sometimes, you read a book and it fills you with this weird evangelical zeal, and you become convinced that the shattered world will never be put back together unless and until all living humans read the book.","John Green,","books, power-of-words, reading",26906
All you need is love. But a little chocolate now and then doesn't hurt.,Charles M. Schulz,"chocolate, food, humor",26781
Beauty is in the eye of the beholder and it may be necessary from time to time to give a stupid or misinformed beholder a black eye.,Jim Henson,,26432
"Of course it is happening inside your head, Harry, but why on earth should that mean that it is not real?","J.K. Rowling,",dumbledore,26248
"Today you are You, that is truer than true. There is no one alive who is Youer than You.","Dr. Seuss,","comedy, life, yourself",25754
I'm not afraid of death; I just don't want to be there when it happens.,Woody Allen,"death, fear, humor, life",25631
"If one cannot enjoy reading a book over and over again, there is no use in reading it at all.",Oscar Wilde,"books, reading",25498
"To the well-organized mind, death is but the next great adventure.","J.K. Rowling,","death, dumbledore, harry, inspirational, philosophers-stone, ron, sorcerers-stone",25372
"It is impossible to live without failing at something, unless you live so cautiously that you might as well not have lived at all—in which case, you fail by default.",J.K. Rowling,,25169
"If you want your children to be intelligent, read them fairy tales. If you want them to be more intelligent, read them more fairy tales.",Albert Einstein," children, fairy-tales",25143
"I'm in love with you,"" he said quietly.

""Augustus,"" I said.

""I am,"" he said. He was staring at me, and I could see the corners of his eyes crinkling. ""I'm in love with you, and I'm not in the business of denying myself the simple pleasure of saying true things. I'm in love with you, and I know that love is just a shout into the void, and that oblivion is inevitable, and that we're all doomed and that there will come a day when all our labor has been returned to dust, and I know the sun will swallow the only earth we'll ever have, and I am in love with you.","John Green,","doomed, inevitable, love, oblivion, pleasure, simple",24814
Logic will get you from A to Z; imagination will get you everywhere.,Albert Einstein, imagination,24666
"I am nothing special, of this I am sure. I am a common man with common thoughts and I've led a common life. There are no monuments dedicated to me and my name will soon be forgotten, but I've loved another with all my heart and soul, and to me, this has always been enough..","Nicholas Sparks,",love,24464
"Whenever I feel the need to exercise, I lie down until it goes away.",Paul Terry,"exercise, humor, laziness, misattributed-to-hutchins",24401
"The truth is, everyone is going to hurt you. You just got to find the ones worth suffering for.",Bob Marley,friendship,24342
"Sometimes people are beautiful.
Not in looks.
Not in what they say.
Just in what they are.","Markus Zusak,","beauty, life",24256
"Have you fallen in love with the wrong person yet?'
Jace said, ""Unfortunately, Lady of the Haven, my one true love remains myself.""
...""At least,"" she said, ""you don't have to worry about rejection, Jace Wayland.""
""Not necessarily. I turn myself down occasionally, just to keep it interesting.","Cassandra Clare,","city-of-bones, jace",24208
"Love looks not with the eyes, but with the mind; And therefore is wing'd Cupid painted blind. Nor hath love's mind of any judgment taste; Wings and no eyes figure unheedy haste: And therefore is love said to be a child, Because in choice he is so oft beguil'd.","William Shakespeare,",love,24115
You don't get to choose if you get hurt in this world...but you do have some say in who hurts you. I like my choices.,"John Green,","satisfaction, self-determination",23989
"Do what you can, with what you have, where you are.",Theodore Roosevelt,inspirational,23815
Folks are usually about as happy as they make their minds up to be.,Abraham Lincoln, happiness,23758
"The more that you read, the more things you will know. The more that you learn, the more places you'll go.","Dr. Seuss,",,23687
There is no friend as loyal as a book.,Ernest Hemingway,"books, friends, novelist-quotes",23569
"The story so far:
In the beginning the Universe was created.
This has made a lot of people very angry and been widely regarded as a bad move.","Douglas Adams,","humor, scifi",23396
"Success is not final, failure is not fatal: it is the courage to continue that counts.",Winston S. Churchill,"bravery, courage, failure, inspirational, success",23379
"One good thing about music, when it hits you, you feel no pain.",Bob Marley,music,23153
"I find television very educating. Every time somebody turns on the set, I go into the other room and read a book.",Groucho Marx,"books, humor, reading, television",23103
"Love is like the wind, you can't see it but you can feel it.","Nicholas Sparks,","love, simile",22899
"There is nothing I would not do for those who are really my friends. I have no notion of loving people by halves, it is not my nature.","Jane Austen,","friendship, love",22897
"So, this is my life. And I want you to know that I am both happy and sad and I'm still trying to figure out how that could be.","Stephen Chbosky,","charlie, favourite-books, inspirational, sad, soul-searching, wallflower",22897
"When one door of happiness closes, another opens; but often we look so long at the closed door that we do not see the one which has been opened for us.",Helen Keller,,22807
Not all of us can do great things. But we can do small things with great love.,Mother Teresa,"misattributed-to-mother-teresa, paraphrased",22685
"Listen to the mustn'ts, child. Listen to the don'ts. Listen to the shouldn'ts, the impossibles, the won'ts. Listen to the never haves, then listen close to me... Anything can happen, child. Anything can be.",Shel Silverstein,"anything-can-be, hope, impossible, inspirational, musn-t, possibilities, shouldn-t, won-t",22563
Some people never go crazy. What truly horrible lives they must lead.,Charles Bukowski,humor,22444
"Life is like riding a bicycle. To keep your balance, you must keep moving.",Albert Einstein,"life, simile",22430
"You don't love someone because they're perfect, you love them in spite of the fact that they're not.","Jodi Picoult,","imperfect, love",22234
