quote,author,tags,likes
"Sometimes you climb out of bed in the morning and you think, I'm not going to make it, but you laugh inside — remembering all the times you've felt that way.",Charles Bukowski,humour,8612
"One, remember to look up at the stars and not down at your feet. Two, never give up work. Work gives you meaning and purpose and life is empty without it. Three, if you are lucky enough to find love, remember it is there and don't throw it away.",Stephen Hawking,"philosophy, science",8610
Those who dream by day are cognizant of many things which escape those who dream only by night.,"Edgar Allan Poe,",,8609
"I believe in everything until it's disproved. So I believe in fairies, the myths, dragons. It all exists, even if it's in your mind. Who's to say that dreams and nightmares aren't as real as the here and now?",John Lennon,"beatles, dragons, dreamers, dreaming, dreams, fairies, faith, mythology, nightmares, reality, truth",8588
Eating and reading are two pleasures that combine admirably.,C.S. Lewis,eating-reading,8586
"I heard what you said. I’m not the silly romantic you think. I don’t want the heavens or the shooting stars. I don’t want gemstones or gold. I have those things already. I want…a steady hand. A kind soul. I want to fall asleep, and wake, knowing my heart is safe. I want to love, and be loved.",Shana Abe,"love, romance",8584
"Here’s to books, the cheapest vacation you can buy.",Charlaine Harris,books-vacation,8571
"I wanted so badly to lie down next to her on the couch, to wrap my arms around her and sleep. Not fuck, like in those movies. Not even have sex. Just sleep together in the most innocent sense of the phrase. But I lacked the courage and she had a boyfriend and I was gawky and she was gorgeous and I was hopelessly boring and she was endlessly fascinating. So I walked back to my room and collapsed on the bottom bunk, thinking that if people were rain, I was drizzle and she was hurricane.","John Green,",unrequited-love,8569
"You can talk with someone for years, everyday, and still, it won't mean as much as what you can have when you sit in front of someone, not saying a word, yet you feel that person with your heart, you feel like you have known the person for forever.... connections are made with the heart, not the tongue.",C. JoyBell C.,"affection, communication, heartwarming, human-connections, human-nature, humanism, humanity, inspirational, inspirational-life, inspirational-love, inspirational-quotes, relationships",8550
"You could rattle the stars,"" she whispered. ""You could do anything, if only you dared. And deep down, you know it, too. That’s what scares you most.","Sarah J. Maas,",,8523
"A guy and a girl can be just friends, but at one point or another, they will fall for each other...Maybe temporarily, maybe at the wrong time, maybe too late, or maybe forever",Dave Matthews Band,,8520
Hell is empty and all the devils are here.,"William Shakespeare,",inspirational,8520
"It is the unknown we fear when we look upon death and darkness, nothing more.","J.K. Rowling,",fear-unknown,8496
Pain is inevitable. Suffering is optional.,"haruki murakami,","inspirational, running",8488
Reading is one form of escape. Running for your life is another.,Lemony Snicket,humor-reading,8488
The world is a book and those who do not travel read only one page.,St. Augustine,"allegory, books, broad-mindedness, classic, education, imagery, travel, world",8449
"If a cluttered desk is a sign of a cluttered mind, of what, then, is an empty desk a sign?",Laurence J. Peter,misattributed-einstein,8448
"If you're reading this...
Congratulations, you're alive.
If that's not something to smile about,
then I don't know what is.","Chad Sugg,","alive, congratulations, hope, humanity, inspiration, inspirational, inspire, life, poetry, smile, wisdom",8430
"One day I will find the right words, and they will be simple.","Jack Kerouac,","dharma, simplicity, writing",8428
"Reality is merely an illusion, albeit a very persistent one.",Albert Einstein,reality,8420
I am not young enough to know everything.,Oscar Wilde,age,8418
In a time of deceit telling the truth is a revolutionary act.,George Orwell,truth,8397
"If we knew what it was we were doing, it would not be called research, would it?",Albert Einstein,science,8393
"The mind is its own place, and in itself can make a heaven of hell, a hell of heaven..","John Milton,","inspirational, religion",8386
How lucky I am to have known somebody and something that saying goodbye to is so damned awful.,"Evans G. Valens,",misattributed-to-a-a-milne,8344
"Monsters are real, and ghosts are real too. They live inside us, and sometimes, they win.",Stephen King,life,8338
You get a little moody sometimes but I think that's because you like to read. People that like to read are always a little fucked up.,"Pat Conroy,",,8329
"I learned this, at least, by my experiment: that if one advances confidently in the direction of his dreams, and endeavors to live the life which he has imagined, he will meet with a success unexpected in common hours.","Henry David Thoreau,",,8321
"I might be in love with you."" He smiles a little. ""I'm waiting until I'm sure to tell you, though.","Veronica Roth,",humorous,8301
"It is not the critic who counts; not the man who points out how the strong man stumbles, or where the doer of deeds could have done them better. The credit belongs to the man who is actually in the arena, whose face is marred by dust and sweat and blood; who strives valiantly; who errs, who comes short again and again, because there is no effort without error and shortcoming; but who does actually strive to do the deeds; who knows great enthusiasms, the great devotions; who spends himself in a worthy cause; who at the best knows in the end the triumph of high achievement, and who at the worst, if he fails, at least fails while daring greatly, so that his place shall never be with those cold and timid souls who neither know victory nor defeat.",Theodore Roosevelt,"inspirational, politics, presidential",8298
Don’t go around saying the world owes you a living. The world owes you nothing. It was here first.,Mark Twain,"living, world",8282
"There is nothing either good or bad, but thinking makes it so.","William Shakespear,",philosophy,8265
I have no special talents. I am only passionately curious.,Albert Einstein,,8255
"We live and breathe words. .... It was books that made me feel that perhaps I was not completely alone. They could be honest with me, and I with them. Reading your words, what you wrote, how you were lonely sometimes and afraid, but always brave; the way you saw the world, its colors and textures and sounds, I felt--I felt the way you thought, hoped, felt, dreamt. I felt I was dreaming and thinking and feeling with you. I dreamed what you dreamed, wanted what you wanted--and then I realized that truly I just wanted you.","Cassandra Clare,","dreams, letters, love, love-at-first-sight, power-of-words, writing",8252
Never go to bed mad. Stay up and fight.,Phyllis Diller,"anger, funny, sleep",8252
There are no good girls gone wrong - just bad girls found out.,Mae West,women,8245
"Do you remember back at the hotel when you promised that if we lived, you’d get dressed up in a nurse’s outfit and give me a sponge bath?"" asked Jace.
""It was Simon who promised you the sponge bath.""
""As soon as I’m back on my feet, handsome,"" said Simon.
""I knew we should have left you a rat.","Cassandra Clare,","bath, clary-fray, humor, jace-wayland, simon-lewis",8226
"I've never been lonely. I've been in a room -- I've felt suicidal. I've been depressed. I've felt awful -- awful beyond all -- but I never felt that one other person could enter that room and cure what was bothering me...or that any number of people could enter that room. In other words, loneliness is something I've never been bothered with because I've always had this terrible itch for solitude. It's being at a party, or at a stadium full of people cheering for something, that I might feel loneliness. I'll quote Ibsen, ""The strongest men are the most alone."" I've never thought, ""Well, some beautiful blonde will come in here and give me a fuck-job, rub my balls, and I'll feel good."" No, that won't help. You know the typical crowd, ""Wow, it's Friday night, what are you going to do? Just sit there?"" Well, yeah. Because there's nothing out there. It's stupidity. Stupid people mingling with stupid people. Let them stupidify themselves. I've never been bothered with the need to rush out into the night. I hid in bars, because I didn't want to hide in factories. That's all. Sorry for all the millions, but I've never been lonely. I like myself. I'm the best form of entertainment I have. Let's drink more wine!",Charles Bukowski,loneliness,8208
"I wanted you to see what real courage is, instead of getting the idea that courage is a man with a gun in his hand. It's when you know you're licked before you begin, but you begin anyway and see it through no matter what.","Harper Lee,","atticus-finch, courage",8206
"It is a curious thing, the death of a loved one. We all know that our time in this world is limited, and that eventually all of us will end up underneath some sheet, never to wake up. And yet it is always a surprise when it happens to someone we know. It is like walking up the stairs to your bedroom in the dark, and thinking there is one more stair than there is. Your foot falls down, through the air, and there is a sickly moment of dark surprise as you try and readjust the way you thought of things.","Lemony Snicket,",death,8185
"A life spent making mistakes is not only more honorable, but more useful than a life spent doing nothing.",George Bernard Shaw,"art, life",8183
"I hope that in this year to come, you make mistakes. Because if you are making mistakes...you're Doing Something.",Neil Gaiman,,8156
"The world is indeed full of peril, and in it there are many dark places; but still there is much that is fair, and though in all lands love is now mingled with grief, it grows perhaps the greater.","J.R.R. Tolkien,","hope, inspirational, love",8148
I like work: it fascinates me. I can sit and look at it for hours.,Jerome K. Jerome,"humor, work",8148
"We delight in the beauty of the butterfly, but rarely admit the changes it has gone through to achieve that beauty.",Maya Angelou,inspiration,8146
Always do what you are afraid to do.,Ralph Waldo Emerson,inspirational,8140
A thing is not necessarily true because a man dies for it.,Oscar Wilde,"belief, death, ideals, martyr, truth",8131
Talent hits a target no one else can hit. Genius hits a target no one else can see.,Arthur Schopenhauer,"inspirational, talent",8130
"There is neither happiness nor misery in the world; there is only the comparison of one state with another, nothing more. He who has felt the deepest grief is best able to experience supreme happiness. We must have felt what it is to die, Morrel, that we may appreciate the enjoyments of life.
"" Live, then, and be happy, beloved children of my heart, and never forget, that until the day God will deign to reveal the future to man, all human wisdom is contained in these two words, 'Wait and Hope.",Alexandre Dumas,"hope, inspirational, wisdom",8127
"When I was 5 years old, my mother always told me that happiness was the key to life. When I went to school, they asked me what I wanted to be when I grew up. I wrote down ‘happy’. They told me I didn’t understand the assignment, and I told them they didn’t understand life.",John Lennon,"inspirational, life",8104
"They say a person needs just three things to be truly happy in this world: someone to love, something to do, and something to hope for.",Tom Bodett,"happiness, hope, joy, love, wishing",8099
I have decided to stick to love...Hate is too great a burden to bear.,"Martin Luther King Jr.,","hate, love",8072
"There are two motives for reading a book; one, that you enjoy it; the other, that you can boast about it.",Bertrand Russell,,8038
Our lives begin to end the day we become silent about things that matter.,"Martin Luther King Jr.,",inspirational,8037
"I think that if I ever have kids, and they are upset, I won't tell them that people are starving in China or anything like that because it wouldn't change the fact that they were upset. And even if somebody else has it much worse, that doesn't really change the fact that you have what you have.","Stephen Chbosky,",honesty,8036
"Somewhere, something incredible is waiting to be known.",Carl Sagan,"astronomer, science, writer",8034
"It is hard enough to remember my opinions, without also remembering my reasons for them!",Friedrich Nietzsche,"humor, philosophy",8029
What's meant to be will always find a way,Trisha Yearwood,"fate, inspiration, love",8027
"May I see you again?"" he asked. There was an endearing nervousness in his voice.

I smiled. ""Sure.""

""Tomorrow?"" he asked.

""Patience, grasshopper,"" I counseled. ""You don't want to seem overeager.

""Right, that's why I said tomorrow,"" he said. ""I want to see you again tonight. But I'm willing to wait all night and much of tomorrow."" I rolled my eyes. ""I'm serious,"" he said.

""You don't even know me,"" I said. I grabbed the book from the center console. ""How about I call you when I finish this?""

""But you don't even have my phone number,"" he said.

""I strongly suspect you wrote it in this book.""

He broke out into that goofy smile. ""And you say we don't know each other.","John Green,",,7985
Make it a rule never to give a child a book you would not read yourself.,George Bernard Shaw,"books, children",7970
"When his life was ruined, his family killed, his farm destroyed, Job knelt down on the ground and yelled up to the heavens, ""Why god? Why me?"" and the thundering voice of God answered, There's just something about you that pisses me off.","Stephen King,","god, humor, religion",7968
"That's always seemed so ridiculous to me, that people want to be around someone because they're pretty. It's like picking your breakfeast cereals based on color instead of taste.","John Green,","attraction, beauty, popularity",7956
"It is a truth universally acknowledged, that a single man in possession of a good fortune, must be in want of a wife.","Jane Austen,","husband, marriage, opening-lines, wife",7955
"I spent my life folded between the pages of books.
In the absence of human relationships I formed bonds with paper characters. I lived love and loss through stories threaded in history; I experienced adolescence by association. My world is one interwoven web of words, stringing limb to limb, bone to sinew, thoughts and images all together. I am a being comprised of letters, a character created by sentences, a figment of imagination formed through fiction.","Tahereh Mafi,","books, power-of-words, reading",7952
All happy families are alike; each unhappy family is unhappy in its own way.,"Leo Tolstoy ,","family, first-sentence",7943
Sarcasm is the last refuge of the imaginatively bankrupt.,"Cassandra Clare,","clary, jace, sarcasm",7935
And the day came when the risk to remain tight in a bud was more painful than the risk it took to blossom.,Anais Nin,,7924
"Do not let your fire go out, spark by irreplaceable spark in the hopeless swamps of the not-quite, the not-yet, and the not-at-all. Do not let the hero in your soul perish in lonely frustration for the life you deserved and have never been able to reach. The world you desire can be won. It exists.. it is real.. it is possible.. it's yours.","Ayn Rand,","inspirational, life",7917
Hearts are made to be broken.,"Oscar Wilde,",,7906
"In the end, we will remember not the words of our enemies, but the silence of our friends.",Martin Luther King Jr.,inspirational,7891
Be the reason someone smiles. Be the reason someone feels loved and believes in the goodness in people.,"Roy T. Bennett,","being-human, goodness, human, human-nature, humanism, humanity, inspiration, inspirational, inspirational-attitude, inspirational-life, inspirational-quote, inspirational-quotes, inspire, inspiring, kindness, life, life-and-living, life-lessons, life-philosophy, life-quotes, living, love, optimism, optimistic, positive, positive-affirmation, positive-life, positive-thinking, smile, smiles",7883
"And by the way, everything in life is writable about if you have the outgoing guts to do it, and the imagination to improvise. The worst enemy to creativity is self-doubt.","Sylvia Plath,",writing,7876
"I'm coming back into focus when Caesar asks him if he has a girlfriend back home. Peeta hesitates, then gives an unconvincing shake of his head.

Handsome lad like you. There must be some special girl. Come on, what’s her name?"" says Caesar.

Peeta sighs. ""Well, there is this one girl. I’ve had a crush on her ever since I can remember. But I’m pretty sure she didn’t know I was alive until the reaping.""

Sounds of sympathy from the crowd. Unrequited love they can relate to.

She have another fellow?"" asks Caesar.

I don’t know, but a lot of boys like her,"" says Peeta.

So, here’s what you do. You win, you go home. She can’t turn you down then, eh?"" says Caesar encouragingly.

I don’t think it’s going to work out. Winning...won’t help in my case,"" says Peeta.

Why ever not?"" says Caesar, mystified.

Peeta blushes beet red and stammers out. ""Because...because...she came here with me.","Suzanne Collins,",peeta,7874
The flower that blooms in adversity is the rarest and most beautiful of all.,"Walt Disney Company,","inspiration, life",7874
"There is a theory which states that if ever anyone discovers exactly what the Universe is for and why it is here, it will instantly disappear and be replaced by something even more bizarre and inexplicable.

There is another theory which states that this has already happened.","Douglas Adams,",humor,7865
"There are few people whom I really love, and still fewer of whom I think well. The more I see of the world, the more am I dissatisfied with it; and every day confirms my belief of the inconsistency of all human characters, and of the little dependence that can be placed on the appearance of merit or sense.","Jane Austen,","elizabeth-bennet, jane-austen",7849
"Malachi scowled. ""I don't remember the Clave inviting you into the Glass City, Magnus Bane.""
""They didn't,"" Magnus said. ""Your wards are down.""
""Really?"" the Consul's voice dripped sarcasm. ""I hadn't noticed.""
Magnus looked concerned. ""That's terrible. Someone should have told you."" He glanced at Luke. ""Tell him the wards are down.","Cassandra Clare,","consul, humor, magnus-bane, sarcasm",7839
I have loved the stars too fondly to be fearful of the night.,Sarah Williams,"night, poetry",7831
"Of all sad words of tongue or pen, the saddest are these, 'It might have been.",John Greenleaf Whittier,"life, words",7827
Fantasy is hardly an escape from reality. It's a way of understanding it.,Lloyd Alexander,,7823
"The loneliest moment in someone’s life is when they are watching their whole world fall apart, and all they can do is stare blankly.",F. Scott Fitzgerald,"loneliness, misattributed",7821
"Whoever fights monsters should see to it that in the process he does not become a monster. And if you gaze long enough into an abyss, the abyss will gaze back into you.",Friedrich Nietzsche,"corruption, dark-side, fighting, monsters, soul",7799
The wound is the place where the Light enters you.,Rumi,"brokenness, healing, scars, suffering",7798
It is so hard to leave—until you leave. And then it is the easiest goddamned thing in the world.,"John Green,",,7796
"For you, a thousand times over","Khaled Hosseini,",,7792
"You don't love someone for their looks, or their clothes, or for their fancy car, but because they sing a song only you can hear.",oscar wilde,attributed-no-source,7782
"You have enemies? Good. That means you've stood up for something, sometime in your life.",Winston Churchill," convictions, criticism",7772
"If you're going to try, go all the way. Otherwise, don't even start. This could mean losing girlfriends, wives, relatives and maybe even your mind. It could mean not eating for three or four days. It could mean freezing on a park bench. It could mean jail. It could mean derision. It could mean mockery--isolation. Isolation is the gift. All the others are a test of your endurance, of how much you really want to do it. And, you'll do it, despite rejection and the worst odds. And it will be better than anything else you can imagine. If you're going to try, go all the way. There is no other feeling like that. You will be alone with the gods, and the nights will flame with fire. You will ride life straight to perfect laughter. It's the only good fight there is.","Charles Bukowski,","fire, flame, isolation, laughter, loss, sacrifice",7747
Think before you speak. Read before you think.,"Fran Lebowitz,","advice-for-daily-living, books, reader, reading, speaking, thinking, wisdom",7738
"THE FIRST TEN LIES THEY TELL YOU IN HIGH SCHOOL

1. We are here to help you.
2. You will have time to get to your class before the bell rings.
3. The dress code will be enforced.
4. No smoking is allowed on school grounds.
5. Our football team will win the championship this year.
6. We expect more of you here.
7. Guidance counselors are always available to listen.
8. Your schedule was created with you in mind.
9. Your locker combination is private.
10. These will be the years you look back on fondly.

TEN MORE LIES THEY TELL YOU IN HIGH SCHOOL

1. You will use algebra in your adult lives.
2. Driving to school is a privilege that can be taken away.
3. Students must stay on campus during lunch.
4. The new text books will arrive any day now.
5. Colleges care more about you than your SAT scores.
6. We are enforcing the dress code.
7. We will figure out how to turn off the heat soon.
8. Our bus drivers are highly trained professionals.
9. There is nothing wrong with summer school.
10. We want to hear what you have to say.","Laurie Halse Anderson,","humor, school",7710
"The boy never cried again, and he never forgot what he'd learned: that to love is to destroy, and that to be loved is to be the one destroyed.","Cassandra Clare,","city-of-bones, jace-wayland",7700
"Whether you think you can, or you think you can't--you're right.",Henry Ford,thinking,7696
Never let your sense of morals prevent you from doing what is right.,"Isaac Asimov,","humor, inspirational, philosophy, wisdom",7691
"If all else perished, and he remained, I should still continue to be; and if all else remained, and he were annihilated, the universe would turn to a mighty stranger.","Emily Jane Brontë ,",,7681
"Once you learn to read, you will be forever free.",Frederick Douglass,,7679
Think of all the beauty still left around you and be happy.,Anne Frank,"anne, beauty, frank, happy",7670
"Two people in love, alone, isolated from the world, that's beautiful.",Milan Kundera,,7650
"Why did you do all this for me?' he asked. 'I don't deserve it. I've never done anything for you.' 'You have been my friend,' replied Charlotte. 'That in itself is a tremendous thing.","E.B. White,",friendship,7649
"Here's all you have to know about men and women: women are crazy, men are stupid. And the main reason women are crazy is that men are stupid.","George Carlin,","crazy, men, stupid, truth, women",7620
"Give a girl the right shoes, and she can conquer the world.",Bette Midler,misattributed-to-marilyn-monroe,7620
Faith is taking the first step even when you can't see the whole staircase.,Martin Luther King Jr.,inspirational-faith,7616
"I did not attend his funeral, but I sent a nice letter saying I approved of it.",Mark Twain,"classic-insult, funeral, funny, humor",7614
"You know, you could live a thousand lifetimes and not deserve him.","Suzanne Collins,",,7607
"Augustus Waters was a self-aggrandizing bastard. But we forgive him. We forgive him not because he had a heart as figuratively good as his literal one sucked, or because he knew more about how to hold a cigarette than any nonsmoker in history, or because he got eighteen years when he should've gotten more.'
'Seventeen,' Gus corrected.
'I'm assuming you've got some time, you interupting bastard.
'I'm telling you,' Isaac continued, 'Augustus Waters talked so much that he'd interupt you at his own funeral. And he was pretentious: Sweet Jesus Christ, that kid never took a piss without pondering the abundant metaphorical resonances of human waste production. And he was vain: I do not believe I have ever met a more physically attractive person who was more acutely aware of his own physical attractiveness.
'But I will say this: When the scientists of the future show up at my house with robot eyes and they tell me to try them on, I will tell the scientists to screw off, because I do not want to see a world without him.'
I was kind of crying by then.","John Green,","john-green, tfios, the-fault-in-our-stars",7592
"The best index to a person's character is how he treats people who can't do him any good, and how he treats people who can't fight back.",Abigail Van Buren,"character, life, wisdom",7568
"We're all going to die, all of us, what a circus! That alone should make us love each other but it doesn't. We are terrorized and flattened by trivialities, we are eaten up by nothing.",Charles Bukowski,,7564
"This above all: to thine own self be true,
And it must follow, as the night the day,
Thou canst not then be false to any man.","William Shakespeare,",,7563
I want to stand as close to the edge as I can without going over. Out on the edge you see all kinds of things you can't see from the center.,"Kurt Vonnegut,",,7560
