quote,author,tags,likes
"If you live to be a hundred, I want to live to be a hundred minus one day so I never have to live without you.","Joan Powers,","friendship, misattributed-a-a-milne",22205
"People think a soul mate is your perfect fit, and that's what everyone wants. But a true soul mate is a mirror, the person who shows you everything that is holding you back, the person who brings you to your own attention so you can change your life.

A true soul mate is probably the most important person you'll ever meet, because they tear down your walls and smack you awake. But to live with a soul mate forever? Nah. Too painful. Soul mates, they come into your life just to reveal another layer of yourself to you, and then leave.

A soul mates purpose is to shake you up, tear apart your ego a little bit, show you your obstacles and addictions, break your heart open so new light can get in, make you so desperate and out of control that you have to transform your life, then introduce you to your spiritual master...","Elizabeth Gilbert,",love,22182
"Love never dies a natural death. It dies because we don't know how to replenish its source. It dies of blindness and errors and betrayals. It dies of illness and wounds; it dies of weariness, of witherings, of tarnishings.",Anais Nin,"death, love",22037
"What really knocks me out is a book that, when you're all done reading it, you wish the author that wrote it was a terrific friend of yours and you could call him up on the phone whenever you felt like it. That doesn't happen much, though.","J.D. Salinger,","authors, books, literature, reading, writing",21999
Not all those who wander are lost.,"J.R.R. Tolkien,","bilbo, journey, lost, quest, travel, wander",21695
"It matters not what someone is born, but what they grow to be.","J.K. Rowling,",dumbledore,21680
If I had a flower for every time I thought of you...I could walk through my garden forever.,Alfred Tennyson,"friendship, love",21667
"Saying 'I notice you're a nerd' is like saying, 'Hey, I notice that you'd rather be intelligent than be stupid, that you'd rather be thoughtful than be vapid, that you believe that there are things that matter more than the arrest record of Lindsay Lohan. Why is that?' In fact, it seems to me that most contemporary insults are pretty lame. Even 'lame' is kind of lame. Saying 'You're lame' is like saying 'You walk with a limp.' Yeah, whatever, so does 50 Cent, and he's done all right for himself.",John Green,"humor, nerdfighters",21642
"If you can make a woman laugh, you can make her do anything.",Marilyn Monroe," girls, love",21576
"We’re all a little weird. And life is a little weird. And when we find someone whose weirdness is compatible with ours, we join up with them and fall into mutually satisfying weirdness—and call it love—true love.","Robert Fulghum,","love, weirdness",21534
The difference between genius and stupidity is: genius has its limits.,Alexandre Dumas-fils,misattributed-to-einstein,21522
It is what you read when you don't have to that determines what you will be when you can't help it.,Oscar Wilde,"books, reading",21464
"The trouble with having an open mind, of course, is that people will insist on coming along and trying to put things in it.","Terry Pratchett,","humor, open-mind, thinking",21370
"I wish it need not have happened in my time,"" said Frodo.
""So do I,"" said Gandalf, ""and so do all who live to see such times. But that is not for them to decide. All we have to decide is what to do with the time that is given us.","J.R.R. Tolkien,","adventuring, death, time",21343
Do one thing every day that scares you.,Eleanor Roosevelt,"attributed, fear, inspiration",21256
"I would venture to guess that Anon, who wrote so many poems without signing them, was often a woman.","Virginia Woolf,",women,21197
Some infinities are bigger than other infinities.,"John Green,",,21173
"You don’t have a soul, Doctor. You are a soul. You have a body, temporarily.","Walter M. Miller Jr.,","body-soul, misattributed-to-c-s-lewis",21145
"One must always be careful of books,"" said Tessa, ""and what is inside them, for words have the power to change us.","Cassandra Clare,",books,21135
Reality continues to ruin my life.,"Bill Watterson,","calvin-and-hobbes, humor, life",21108
Time you enjoy wasting is not wasted time.,"Marthe Troly-Curtin,","happiness, misattributed-john-lennon, procrastination, time",20959
Things change. And friends leave. Life doesn't stop for anybody.,"Stephen Chbosky,","change, life",20930
"If there's a book that you want to read, but it hasn't been written yet, then you must write it.",Toni Morrison,"books, writing",20664
"I declare after all there is no enjoyment like reading! How much sooner one tires of any thing than of a book! -- When I have a house of my own, I shall be miserable if I have not an excellent library.","Jane Austen,","books, library, reading",20497
"There is no pretending,"" Jace said with absolute clarity. ""I love you, and I will love you until I die, and if there is life after that, I'll love you then.","Cassandra Clare,","mortal-instruments, romance, teen-fantasy",20437
"To love at all is to be vulnerable. Love anything and your heart will be wrung and possibly broken. If you want to make sure of keeping it intact you must give it to no one, not even an animal. Wrap it carefully round with hobbies and little luxuries; avoid all entanglements. Lock it up safe in the casket or coffin of your selfishness. But in that casket, safe, dark, motionless, airless, it will change. It will not be broken; it will become unbreakable, impenetrable, irredeemable. To love is to be vulnerable.","C.S. Lewis,",love,20429
"Who are you to judge the life I live?
I know I'm not perfect
-and I don't live to be-
but before you start pointing fingers...
make sure you hands are clean!",Bob Marley,"judge, life, live, perfection",20307
The real lover is the man who can thrill you by kissing your forehead or smiling into your eyes or just staring into space.,Marilyn Monroe, love,20143
The only way out of the labyrinth of suffering is to forgive.,"John Green,","compassion, life, suffering",20098
The books that the world calls immoral are books that show the world its own shame.,"Oscar Wilde,","books, morality, reading",19970
"And, when you want something, all the universe conspires in helping you to achieve it.","Paulo Coelho,",inspirational,19958
"When someone loves you, the way they talk about you is different. You feel safe and comfortable.","Jess C. Scott,","desire, emotion, friendship, honesty, imagination, individuality, life, love, passion, reality, relationships, romance, truth, wisdom, wise-words",19954
"I can never read all the books I want; I can never be all the people I want and live all the lives I want. I can never train myself in all the skills I want. And why do I want? I want to live and feel all the shades, tones and variations of mental and physical experience possible in my life. And I am horribly limited.","Sylvia Plath,","books, life, limits",19863
Go to heaven for the climate and hell for the company.,Benjamin Franklin Wade,"humor, misattributed-mark-twain, philosophy, theology",19791
The reason I talk to myself is because I’m the only one whose answers I accept.,George Carlin,"humor, insanity, lies, lying, self-indulgence, truth",19769
"Piglet sidled up to Pooh from behind.
""Pooh!"" he whispered.
""Yes, Piglet?""
""Nothing,"" said Piglet, taking Pooh's paw. ""I just wanted to be sure of you.","A.A. Milne,","friendship, piglet, pooh, reassurance",19653
"He's like a drug for you, Bella.","Stephenie Meyer,",,19609
"Do not pity the dead, Harry. Pity the living, and, above all those who live without love.","J.K. Rowling,",live-death-love,19606
There is nothing to writing. All you do is sit down at a typewriter and bleed.,Ernest Hemingway,"good, writing",19402
"A wise girl kisses but doesn't love, listens but doesn't believe, and leaves before she is left.",Marilyn Monroe,attributed-no-source,19297
"Dumbledore watched her fly away, and as her silvery glow faded he turned back to Snape, and his eyes were full of tears.
""After all this time?""
""Always,"" said Snape.","J.K. Rowling,","dumbledore, life, love, snape",19295
"You should date a girl who reads.
Date a girl who reads. Date a girl who spends her money on books instead of clothes, who has problems with closet space because she has too many books. Date a girl who has a list of books she wants to read, who has had a library card since she was twelve.

Find a girl who reads. You’ll know that she does because she will always have an unread book in her bag. She’s the one lovingly looking over the shelves in the bookstore, the one who quietly cries out when she has found the book she wants. You see that weird chick sniffing the pages of an old book in a secondhand book shop? That’s the reader. They can never resist smelling the pages, especially when they are yellow and worn.

She’s the girl reading while waiting in that coffee shop down the street. If you take a peek at her mug, the non-dairy creamer is floating on top because she’s kind of engrossed already. Lost in a world of the author’s making. Sit down. She might give you a glare, as most girls who read do not like to be interrupted. Ask her if she likes the book.

Buy her another cup of coffee.

Let her know what you really think of Murakami. See if she got through the first chapter of Fellowship. Understand that if she says she understood James Joyce’s Ulysses she’s just saying that to sound intelligent. Ask her if she loves Alice or she would like to be Alice.

It’s easy to date a girl who reads. Give her books for her birthday, for Christmas, for anniversaries. Give her the gift of words, in poetry and in song. Give her Neruda, Pound, Sexton, Cummings. Let her know that you understand that words are love. Understand that she knows the difference between books and reality but by god, she’s going to try to make her life a little like her favorite book. It will never be your fault if she does.

She has to give it a shot somehow.

Lie to her. If she understands syntax, she will understand your need to lie. Behind words are other things: motivation, value, nuance, dialogue. It will not be the end of the world.

Fail her. Because a girl who reads knows that failure always leads up to the climax. Because girls who read understand that all things must come to end, but that you can always write a sequel. That you can begin again and again and still be the hero. That life is meant to have a villain or two.

Why be frightened of everything that you are not? Girls who read understand that people, like characters, develop. Except in the Twilight series.

If you find a girl who reads, keep her close. When you find her up at 2 AM clutching a book to her chest and weeping, make her a cup of tea and hold her. You may lose her for a couple of hours but she will always come back to you. She’ll talk as if the characters in the book are real, because for a while, they always are.

You will propose on a hot air balloon. Or during a rock concert. Or very casually next time she’s sick. Over Skype.

You will smile so hard you will wonder why your heart hasn’t burst and bled out all over your chest yet. You will write the story of your lives, have kids with strange names and even stranger tastes. She will introduce your children to the Cat in the Hat and Aslan, maybe in the same day. You will walk the winters of your old age together and she will recite Keats under her breath while you shake the snow off your boots.

Date a girl who reads because you deserve it. You deserve a girl who can give you the most colorful life imaginable. If you can only give her monotony, and stale hours and half-baked proposals, then you’re better off alone. If you want the world and the worlds beyond it, date a girl who reads.

Or better yet, date a girl who writes.",Rosemarie Urquico,,19197
You don’t forget the face of the person who was your last hope.,"Suzanne Collins,",the-hunger-games,18933
′Classic′ - a book which people praise and don't read.,Mark Twain,"books, classic, reading",18869
"You may say I'm a dreamer, but I'm not the only one. I hope someday you'll join us. And the world will live as one.",John Lennon,"beatles, connection, dreamers, dreaming, dreams, hope, inspirational, peace",18837
"I am good, but not an angel. I do sin, but I am not the devil. I am just a small girl in a big world trying to find someone to love.",Marilyn Monroe,attributed-no-source,18714
I am free of all prejudice. I hate everyone equally. ,W.C. Fields,,18708
I've been making a list of the things they don't teach you at school. They don't teach you how to love somebody. They don't teach you how to be famous. They don't teach you how to be rich or how to be poor. They don't teach you how to walk away from someone you don't love any longer. They don't teach you how to know what's going on in someone else's mind. They don't teach you what to say to someone who's dying. They don't teach you anything worth knowing.,"Neil Gaiman,","dying, facts, fame, knowing, love, poverty, reality, school, teach, wealth",18670
Finish each day and be done with it. You have done what you could. Some blunders and absurdities no doubt crept in; forget them as soon as you can. Tomorrow is a new day. You shall begin it serenely and with too high a spirit to be encumbered with your old nonsense.,Ralph Waldo Emerson,"life, regrets",18562
"He has achieved success who has lived well, laughed often, and loved much;
Who has enjoyed the trust of pure women, the respect of intelligent men and the love of little children;
Who has filled his niche and accomplished his task;
Who has never lacked appreciation of Earth's beauty or failed to express it;
Who has left the world better than he found it,
Whether an improved poppy, a perfect poem, or a rescued soul;
Who has always looked for the best in others and given them the best he had;
Whose life was an inspiration;
Whose memory a benediction.","Bessie Anderson Stanley,","life, misattributed-to-emerson, success, widely-misattributed",18559
I love mankind ... it's people I can't stand!!,Charles M. Schulz,"humor, mankind, people",18544
You never really understand a person until you consider things from his point of view... Until you climb inside of his skin and walk around in it.,"Harper Lee,",better-life-empathy,18310
I have never let my schooling interfere with my education.,Mark Twain, education,18198
The marks humans leave are too often scars.,"John Green,","humans, pain, scars",18072
Some day you will be old enough to start reading fairy tales again.,C.S. Lewis,"age, fairytales, growing-up",18003
"A lady's imagination is very rapid; it jumps from admiration to love, from love to matrimony in a moment.","Jane Austen,","humor, love, romantic, women",17968
"Remember, we're madly in love, so it's all right to kiss me anytime you feel like it.","Suzanne Collins,",humor,17906
"We are what we pretend to be, so we must be careful about what we pretend to be.","Kurt Vonnegut,","action, attitude, choice, imagination, inspiration, life, pretend",17891
"Our deepest fear is not that we are inadequate. Our deepest fear is that we are powerful beyond measure. It is our light, not our darkness that most frightens us. We ask ourselves, 'Who am I to be brilliant, gorgeous, talented, fabulous?' Actually, who are you not to be? You are a child of God. Your playing small does not serve the world. There is nothing enlightened about shrinking so that other people won't feel insecure around you. We are all meant to shine, as children do. We were born to make manifest the glory of God that is within us. It's not just in some of us; it's in everyone. And as we let our own light shine, we unconsciously give other people permission to do the same. As we are liberated from our own fear, our presence automatically liberates others.","Marianne Williamson,","akeelah, fear, inspirational",17889
Books are a uniquely portable magic.,"Stephen King,","books, magic, reading",17533
"And in that moment, I swear we were infinite.","Stephen Chbosky,",infinity,17502
To die will be an awfully big adventure.,"J.M. Barrie,","adventure, love",17497
Anyone who has never made a mistake has never tried anything new.,Albert Einstein, mistakes,17440
"It’s no use going back to yesterday, because I was a different person then.",Lewis Carroll,"alice, humor, inspirational, philosophy-of-life, psychological, yesterday",17361
The truth is rarely pure and never simple.,"Oscar Wilde,",truth,17311
What a slut time is. She screws everybody.,"John Green,",,17231
"I'm the one that's got to die when it's time for me to die, so let me live my life the way I want to.","Jimi Hendrix,","death, life",17141
It takes courage to grow up and become who you really are.,E.E. Cummings, courage,17072
But better to get hurt by the truth than comforted with a lie.,Khaled Hosseini,life,17049
"You have to write the book that wants to be written. And if the book will be too difficult for grown-ups, then you write it for children.",Madeleine L'Engle,"books, children, difficult, grown-ups, write, writers, writing",16952
"I believe in Christianity as I believe that the sun has risen: not only because I see it, but because by it I see everything else.",C.S. Lewis,,16882
"So it's not gonna be easy. It's going to be really hard; we're gonna have to work at this everyday, but I want to do that because I want you. I want all of you, forever, everyday. You and me... everyday.","Nicholas Sparks,","love, marriage",16826
The fear of death follows from the fear of life. A man who lives fully is prepared to die at any time.,Mark Twain,"death, life",16713
"We believe in ordinary acts of bravery, in the courage that drives one person to stand up for another.","Veronica Roth,","inspirational-quotes, strength-and-courage",16627
"... a mind needs books as a sword needs a whetstone, if it is to keep its edge.","George R.R. Martin,","books, mind",16619
Memories warm you up from the inside. But they also tear you apart.,"Haruki Murakami,",memories,16574
Books are the ultimate Dumpees: put them down and they’ll wait for you forever; pay attention to them and they always love you back.,"John Green,","books, reading",16525
"There is nothing better than a friend, unless it is a friend with chocolate.",Linda Grayson,"chocolate, friendship",16504
"[Dean] “My dear fellow, who will let you?”

[Roark] “That’s not the point. The point is, who will stop me?","Ayn Rand,",,16471
"There are infinite numbers between 0 and 1. There's .1 and .12 and .112 and an infinite collection of others. Of course, there is a bigger infinite set of numbers between 0 and 2, or between 0 and a million. Some infinities are bigger than other infinities. A writer we used to like taught us that. There are days, many of them, when I resent the size of my unbounded set. I want more numbers than I'm likely to get, and God, I want more numbers for Augustus Waters than he got. But, Gus, my love, I cannot tell you how thankful I am for our little infinity. I wouldn't trade it for the world. You gave me a forever within the numbered days, and I'm grateful.","John Green,",infinity,16420
"The truth."" Dumbledore sighed. ""It is a beautiful and terrible thing, and should therefore be treated with great caution.","J.K. Rowling,",truth,16411
I must not fear. Fear is the mind-killer. Fear is the little-death that brings total obliteration. I will face my fear. I will permit it to pass over me and through me. And when it has gone past I will turn the inner eye to see its path. Where the fear has gone there will be nothing. Only I will remain.,"Frank Herbert,","bene-gesserit, fear, litany-against-fear, motivational, scifi",16404
A lie can travel half way around the world while the truth is putting on its shoes.,Mark Twain,"misattributed-mark-twain, truth",16245
Knowing yourself is the beginning of all wisdom.,Aristotle,"introspection, self-discovery, wisdom",16195
Never tell the truth to people who are not worthy of it.,Mark Twain,truth,16180
"I love you as certain dark things are to be loved,
in secret, between the shadow and the soul.","Pablo Neruda,","love, poetry",16126
Perhaps one did not want to be loved so much as to be understood.,"George Orwell,",truth,15974
"Remember, if the time should come when you have to make a choice between what is right and what is easy, remember what happened to a boy who was good, and kind, and brave, because he strayed across the path of Lord Voldemort. Remember Cedric Diggory.","J.K. Rowling,",,15951
"Tis better to have loved and lost
Than never to have loved at all.","Alfred Lord Tennyson,",paraphrase-of-congreve,15949
It's the possibility of having a dream come true that makes life interesting.,"Paulo Coelho,",inspirational,15936
Only the very weak-minded refuse to be influenced by literature and poetry.,"Cassandra Clare,","books, literature, philosphy, poetry, reading",15801
"Just when you think it can't get any worse, it can. And just when you think it can't get any better, it can.","Nicholas Sparks,","life, love",15791
"It's so hard to forget pain, but it's even harder to remember sweetness. We have no scar to show for happiness. We learn so little from peace.","Chuck Palahniuk,","happiness, pain, peace, scar, sweetness",15732
Be nice to nerds. You may end up working for them. We all could.,"Charles J. Sykes,","humor, misattributed-to-bill-gates, nerd, nerds, work",15567
"Be not afraid of greatness. Some are born great, some achieve greatness, and others have greatness thrust upon them.","William Shakespeare,",greatness,15439
The only true wisdom is in knowing you know nothing.,Socrates,"knowledge, wisdom",15406
"What you're supposed to do when you don't like a thing is change it. If you can't change it, change the way you think about it. Don't complain.","Maya Angelou,","1993, advice, complaining, inspirational",15284
"Do you remember me telling you we are practicing non-verbal spells, Potter?""
""Yes,"" said Harry stiffly.
""Yes, sir.""
""There's no need to call me ""sir"" Professor.""
The words had escaped him before he knew what he was saying.","J.K. Rowling,","humor, rebellion, sarcasm",15228
Happiness in intelligent people is the rarest thing I know.,"Ernest Hemingway,",happiness,15031
"He’s not perfect. You aren’t either, and the two of you will never be perfect. But if he can make you laugh at least once, causes you to think twice, and if he admits to being human and making mistakes, hold onto him and give him the most you can. He isn’t going to quote poetry, he’s not thinking about you every moment, but he will give you a part of him that he knows you could break. Don’t hurt him, don’t change him, and don’t expect for more than he can give. Don’t analyze. Smile when he makes you happy, yell when he makes you mad, and miss him when he’s not there. Love hard when there is love to be had. Because perfect guys don’t exist, but there’s always one guy that is perfect for you.",Bob Marley,"inspirational, love",14955
A day without laughter is a day wasted.,Nicolas Chamfort,philosophy,14950
"Yes: I am a dreamer. For a dreamer is one who can only find his way by moonlight, and his punishment is that he sees the dawn before the rest of the world.","Oscar Wilde,",,14681
You can never be overdressed or overeducated.,Oscar Wilde,"education, fashion",14632
"A person's a person, no matter how small.","Dr. Seuss,",inspirational,14542
"I became insane, with long intervals of horrible sanity.",Edgar Allan Poe,,14502
"Thomas Edison's last words were ""It's very beautiful over there"". I don't know where there is, but I believe it's somewhere, and I hope it's beautiful.","John Green,",,14485
"When we honestly ask ourselves which person in our lives mean the most to us, we often find that it is those who, instead of giving advice, solutions, or cures, have chosen rather to share our pain and touch our wounds with a warm and tender hand. The friend who can be silent with us in a moment of despair or confusion, who can stay with us in an hour of grief and bereavement, who can tolerate not knowing, not curing, not healing and face with us the reality of our powerlessness, that is a friend who cares.","Henri Nouwen,","empathy, friends, friendship, inspirational",14174
"Oh, I wouldn't mind, Hazel Grace. It would be a privilege to have my heart broken by you.","John Green,","augustus-waters, hazel, heartbreak, privilege",14036
It is one of the blessings of old friends that you can afford to be stupid with them.,"Ralph Waldo Emerson,",,13998
Numbing the pain for a while will make it worse when you finally feel it.,"J.K. Rowling,",pain,13974
"The one you love and the one who loves you are never, ever the same person.","Chuck Palahniuk,","life, love",13973
"When adults say, ""Teenagers think they are invincible"" with that sly, stupid smile on their faces, they don't know how right they are. We need never be hopeless, because we can never be irreparably broken. We think that we are invincible because we are. We cannot be born, and we cannot die. Like all energy, we can only change shapes and sizes and manifestations. They forget that when they get old. They get scared of losing and failing. But that part of us greater than the sum of our parts cannot begin and cannot end, and so it cannot fail.","John Green,","invincible, teenagers, teens",13968
"I finally understood what true love meant...love meant that you care for another person's happiness more than your own, no matter how painful the choices you face might be.","Nicholas Sparks,","dear-john, nicholas-sparks",13950
"Books are the quietest and most constant of friends; they are the most accessible and wisest of counselors, and the most patient of teachers.",Charles W. Eliot,"books, friends, reading, teachers",13926
